,reviewID,sentenceID,review,target,category,polarity
732,426930,426930:0,Authentic Taiwanese food that's cheap... what more could you ask for?,"Taiwanese food,Taiwanese food","FOOD#QUALITY,FOOD#PRICES","positive,positive"
733,426930,426930:1,(Besides that there should be more restaurants like it around the city).,NULL,RESTAURANT#GENERAL,positive
734,426930,426930:2,The cold appetizer dishes taste like the way I remember them to taste when I was growing up in Taiwan.,cold appetizer dishes,FOOD#QUALITY,positive
735,430342,430342:0,delicious simple food in nice outdoor atmosphere.,"food,food,outdoor atmosphere","FOOD#QUALITY,FOOD#STYLE_OPTIONS,AMBIENCE#GENERAL","positive,positive,positive"
736,430342,430342:1,"Kind, attentive wait staff.",wait staff,SERVICE#GENERAL,positive
737,430342,430342:2,I really like both the scallops and the mahi mahi (on saffron risotto-yum!).,"scallops,mahi mahi (on saffron risotto","FOOD#QUALITY,FOOD#QUALITY","positive,positive"
738,430342,430342:3,My friend devoured her chicken and mashed potatos.,chicken and mashed potatos,FOOD#QUALITY,positive
739,430342,430342:4,Delicious crab cakes too.,crab cakes,FOOD#QUALITY,positive
740,430342,430342:5,"Even if the food wasn't this good, the garden is a great place to sit outside and relax.","garden,food","AMBIENCE#GENERAL,FOOD#QUALITY","positive,positive"
741,430342,430342:6,Great neighborhood joint.,joint,RESTAURANT#GENERAL,positive
742,433878,433878:0,This is a nice pizza place with good selection of thin crust pizza including the Basil slice.,"selection of thin crust pizza,selection of thin crust pizza,pizza place,Basil slice","FOOD#STYLE_OPTIONS,FOOD#QUALITY,RESTAURANT#GENERAL,FOOD#QUALITY","positive,positive,positive,positive"
743,433878,433878:1,"Their calzones are horrific, bad, vomit-inducing, YUCK.",calzones,FOOD#QUALITY,negative
744,433878,433878:2,They smell like they stuff them with old canned vegetables like the spinach mushroom calzone.,NULL,FOOD#QUALITY,negative
745,433878,433878:3,The counter service is bad.,counter service,SERVICE#GENERAL,negative
746,433878,433878:4,They charge different prices all the time.,NULL,SERVICE#GENERAL,negative
747,433878,433878:5,"They're rude at times, and not very friendly.",NULL,SERVICE#GENERAL,negative
748,433878,433878:6,NO PIZZA 33 for me!,PIZZA 33,RESTAURANT#GENERAL,negative
749,436868,436868:0,"Anybody who likes this place must be from a different planet, where greasy, dry and tasteless are complimentary.",NULL,FOOD#QUALITY,negative
750,436868,436868:1,"The dosas are skimpy, unattractive and drip with grease, and personally I'd drink popcorn topping before I'd eat another one of these.","dosas,dosas","FOOD#STYLE_OPTIONS,FOOD#QUALITY","negative,negative"
751,436868,436868:2,"The sandwiches are dry, tasteless and way overpriced.","sandwiches,sandwiches","FOOD#QUALITY,FOOD#PRICES","negative,negative"
752,436868,436868:3,"Calling the place Hampton Chutney Co. does warn you that these folks offer more style than substance, but in this unattractive room with unhelpful clerks there was a dearth of the former too.","place,room,clerks","RESTAURANT#GENERAL,AMBIENCE#GENERAL,SERVICE#GENERAL","negative,negative,negative"
753,444818,444818:0,"Seriously, this place kicks ass.",place,RESTAURANT#GENERAL,positive
754,444818,444818:1,"The atmosphere is unheralded, the service impecible, and the food magnificant.","atmosphere,service,food","AMBIENCE#GENERAL,SERVICE#GENERAL,FOOD#QUALITY","positive,positive,positive"
755,444818,444818:2,"Best Italian food I ever had (and being Italian, that means alot).",Italian food,FOOD#QUALITY,positive
756,444818,444818:3,"It is nearly impossible to get a table, so if you ever have the chance to go here for dinner, DO NOT pass it up.",NULL,RESTAURANT#GENERAL,positive
757,445960,445960:0,"This is such a lovely, peaceful place to eat outside.",place,AMBIENCE#GENERAL,positive
758,445960,445960:1,The restaurant looks out over beautiful green lawns to the Hudson River and the Statue of Liberty.,restaurant,LOCATION#GENERAL,positive
759,445960,445960:2,"It is set far from the small street it's on, and there is no traffic noise.",NULL,LOCATION#GENERAL,positive
760,445960,445960:3,"The food is good, especially their more basic dishes, and the drinks are delicious.","food,basic dishes,drinks","FOOD#QUALITY,FOOD#QUALITY,DRINKS#QUALITY","positive,positive,positive"
761,445960,445960:4,"This is a great place to take out-of-towners, and perfect for watching the sunset.",place,LOCATION#GENERAL,positive
762,447697,447697:0,Great sushi experience.,sushi,FOOD#QUALITY,positive
763,447697,447697:1,Nice value.,NULL,RESTAURANT#PRICES,positive
764,447697,447697:2,Unique apppetizers.,apppetizers,FOOD#QUALITY,positive
765,447697,447697:3,Try sushimi cucumber roll.,sushimi cucumber roll,FOOD#QUALITY,positive
766,449802,449802:0,"Good spreads, great beverage selections and bagels really tasty.","spreads,beverage selections,bagels","FOOD#QUALITY,DRINKS#STYLE_OPTIONS,FOOD#QUALITY","positive,positive,positive"
767,449802,449802:1,THE BIG COMPLAINT: NO TOASTING AVAILABLE.,NULL,SERVICE#GENERAL,negative
768,449802,449802:3,Murray won't do it.,NULL,SERVICE#GENERAL,negative
769,449802,449802:4,Won't or Can't is not in the service directory.,NULL,SERVICE#GENERAL,negative
770,449802,449802:5,But who says Murray's is anything about service.,service,SERVICE#GENERAL,negative
771,449802,449802:6,"So close, but not good enough.",NULL,RESTAURANT#GENERAL,neutral
772,454704,454704:0,Don't be fooled by crowds of people.,NULL,RESTAURANT#MISCELLANEOUS,negative
773,454704,454704:1,The service is awful.,service,SERVICE#GENERAL,negative
774,454704,454704:2,This place is not worth the prices.,"place,place","RESTAURANT#GENERAL,RESTAURANT#PRICES","negative,negative"
775,454704,454704:3,"Also, don't plan on asking for your favorite roll, if it's not on the menu, you can't have it.",NULL,SERVICE#GENERAL,negative
776,455623,455623:0,Love Pizza 33..,Pizza 33,RESTAURANT#GENERAL,positive
777,455623,455623:1,I will be out with friends and all of a sudden I am hungry and I only crave one thing... their Pizza.,Pizza,FOOD#QUALITY,positive
778,455623,455623:3,It hits the spot every time,NULL,RESTAURANT#GENERAL,positive
779,461928,461928:0,This tiny Williamsburg spot is always pleasantly surprising.,Williamsburg spot,RESTAURANT#GENERAL,positive
780,461928,461928:1,The pizza is delicious and the proprietor is one of the nicest in NYC.,"pizza,proprietor","FOOD#QUALITY,SERVICE#GENERAL","positive,positive"
781,461928,461928:3,I've been many time and have never been disappointed.,NULL,RESTAURANT#GENERAL,positive
782,464215,464215:1,They even scoop it out nice (for those on a diet) not too much not to little.,NULL,FOOD#STYLE_OPTIONS,positive
783,464215,464215:2,The cream cheeses are out of this world and I love that coffee!!,"cream cheeses,coffee","FOOD#QUALITY,DRINKS#QUALITY","positive,positive"
784,464215,464215:3,A little crowded but they move that line really fast!,"NULL,NULL","SERVICE#GENERAL,RESTAURANT#MISCELLANEOUS","positive,negative"
785,464215,464215:4,A little pricey but it really hits the spot on a Sunday morning!,"NULL,NULL","RESTAURANT#PRICES,RESTAURANT#GENERAL","negative,positive"
786,464342,464342:0,"Bagels are ok, but be sure not to make any special requests!","Bagels,NULL","FOOD#QUALITY,SERVICE#GENERAL","neutral,negative"
787,464342,464342:1,I asked for an open faced cheese sandwich and the manager basically told me to take my business elsewhere!,manager,SERVICE#GENERAL,negative
788,464342,464342:2,Be sure not to get anything other than bagels!..,"NULL,bagels","FOOD#QUALITY,FOOD#QUALITY","negative,positive"
789,464342,464342:3,the turkey burgers are scary!,turkey burgers,FOOD#QUALITY,negative
790,470488,470488:0,The worst excuse for Japanese food I've ever encountered.,Japanese food,FOOD#QUALITY,negative
791,470488,470488:1,The soup for the udon was soy sauce and water.,soup for the udon,FOOD#QUALITY,negative
792,470488,470488:2,The sushi was awful!,sushi,FOOD#QUALITY,negative
793,470488,470488:3,The rice was poor quality and was cooked so badly it was hard.,rice,FOOD#QUALITY,negative
794,470488,470488:4,"Furthermore, the rice had no seasoning, so the sushi was bland and disgusting.","rice,sushi","FOOD#QUALITY,FOOD#QUALITY","negative,negative"
795,470488,470488:5,"The fish was adequate, but inexpertly sliced.",fish,FOOD#STYLE_OPTIONS,negative
796,470488,470488:6,It is obvious that no one in the restaurant has any idea about or experience with Japanese cuisine.,Japanese cuisine,FOOD#QUALITY,negative
797,475298,475298:0,"Good, fast service.",service,SERVICE#GENERAL,positive
798,475298,475298:1,I would highly recommend.,NULL,RESTAURANT#GENERAL,positive
799,475298,475298:2,Food is great and inexpensive.,"Food,Food","FOOD#QUALITY,FOOD#PRICES","positive,positive"
800,475298,475298:3,The location is perfect.,location,LOCATION#GENERAL,positive
801,475298,475298:4,Give it a try and enjoy.,NULL,RESTAURANT#GENERAL,positive
802,475512,475512:2,"Well, this place is so Ghetto its not even funny.",place,AMBIENCE#GENERAL,negative
803,475512,475512:3,If you like your music blasted and the system isnt that great and if you want to pay at least 100 dollar bottle minimun then you'll love it here.,"bottle minimun,music","DRINKS#PRICES,AMBIENCE#GENERAL","negative,negative"
804,475512,475512:4,Would NEVER go back there.,NULL,RESTAURANT#GENERAL,negative
805,476473,476473:0,Awsome Pizza especially the Margheritta slice.,"Pizza,Margheritta slice","FOOD#QUALITY,FOOD#QUALITY","positive,positive"
806,476473,476473:1,Always busy but fast moving.,NULL,SERVICE#GENERAL,positive
807,476473,476473:2,Great atmoshere and worth every bit.,"atmoshere,NULL","AMBIENCE#GENERAL,RESTAURANT#GENERAL","positive,positive"
808,476473,476473:3,Open late (well as late as I ever got there and I'm a night person),NULL,RESTAURANT#MISCELLANEOUS,positive
809,483111,483111:0,Winnie and her staff are the best crew you can find serving you.,"staff,Winnie","SERVICE#GENERAL,SERVICE#GENERAL","positive,positive"
810,483111,483111:1,The food is reliable and the price is moderate.,"food,NULL","FOOD#QUALITY,RESTAURANT#PRICES","positive,neutral"
811,483111,483111:2,What more can you ask for?,NULL,RESTAURANT#GENERAL,positive
812,485026,485026:0,"For authentic Thai food, look no further than Toons.",Thai food,FOOD#QUALITY,positive
813,485026,485026:2,"Try the Pad Thai, or sample anything on the appetizer menu...they're all delicious.","Pad Thai,appetizer menu","FOOD#QUALITY,FOOD#QUALITY","positive,positive"
814,485767,485767:0,Everything about this restaurant was special.,restaurant,RESTAURANT#GENERAL,positive
815,485767,485767:1,"The service was attentive, yet discreet.",service,SERVICE#GENERAL,positive
816,485767,485767:2,The flavors robust and subtle.,NULL,FOOD#QUALITY,positive
817,485767,485767:3,The brioche and lollies as party favors is a cute and sweet touch to a most memorable meal.,brioche and lollies,FOOD#QUALITY,positive
818,485767,485767:4,I'm saving up for my next visit.,NULL,RESTAURANT#GENERAL,positive
819,485966,485966:1,The place was quiet and delightful.,place,AMBIENCE#GENERAL,positive
820,485966,485966:2,Service was good and food is wonderful.,"Service,food","SERVICE#GENERAL,FOOD#QUALITY","positive,positive"
821,485966,485966:3,I did not try the caviar but I tried their salmon and crab salad (they are all good)  ,"salmon,crab salad","FOOD#QUALITY,FOOD#QUALITY","positive,positive"
822,485966,485966:4,It is definitely a good spot for snacks and chat.,spot,RESTAURANT#GENERAL,positive
823,490565,490565:0,"As a retired hipster, I can say with some degree of certainty that for the last year Lucky Strike has been the best laid-back late night in the city.",Lucky Strike,RESTAURANT#GENERAL,positive
824,490565,490565:1,"The wait staff is pleasant, fun, and for the most part gorgeous (in the wonderful aesthetic beautification way, not in that she's-way-cuter-than-me-that-b@#$* way).",wait staff,SERVICE#GENERAL,positive
825,490565,490565:2,"The food is yummy, especially their cooked-to-perfection mussels in spicy tomato sauce and their shoestring crispy fries.","food,mussels in spicy tomato sauce,fries","FOOD#QUALITY,FOOD#QUALITY,FOOD#QUALITY","positive,positive,positive"
826,490565,490565:3,"But the best part about LS is the late night atmosphere, delightfully free of the BTs.",late night atmosphere,AMBIENCE#GENERAL,positive
827,490565,490565:4,"You can get a completely delish martini in a glass (that's about 2 1/2 drinks) for $8.50 (I recommend the Vanilla Shanty, mmmm!) in a great homey setting with great music.","martini,martini,martini,Vanilla Shanty,setting,music","DRINKS#QUALITY,DRINKS#STYLE_OPTIONS,DRINKS#PRICES,DRINKS#QUALITY,AMBIENCE#GENERAL,AMBIENCE#GENERAL","positive,positive,positive,positive,positive,positive"
828,490565,490565:5,"The in-house lady DJ on Saturday nights has outrageously good taste in music, and moreover, takes requests.",in-house lady DJ,AMBIENCE#GENERAL,positive
829,490565,490565:6,You can't go wrong with this place.,place,RESTAURANT#GENERAL,positive
830,493013,493013:0,Suan is a great place that I often take my friends (classmates) too.,Suan,RESTAURANT#GENERAL,positive
831,493013,493013:1,"Its location is good and the fact that Hutner College is near and their prices are very reasonable, makes students go back to Suan again and again.","location,Suan","LOCATION#GENERAL,RESTAURANT#PRICES","positive,positive"
832,493013,493013:2,I LOVE their Thai,Thai,FOOD#QUALITY,positive
833,493013,493013:3,noodles with shrimp and chicken and coconut juice is the MUST!,noodles with shrimp and chicken and coconut juice,FOOD#QUALITY,positive
834,493013,493013:5,I will go back to Suan soon!,Suan,RESTAURANT#GENERAL,positive
835,493013,493013:6,In summer-eat outside on a terrace (another great feature of Suan)!!!,terrace,AMBIENCE#GENERAL,positive
836,493514,493514:0,I cannot imagine a friendlier staff working in a restaurant.,staff,SERVICE#GENERAL,positive
837,493514,493514:1,I cannot imagine better Indian food in all of the city.,Indian food,FOOD#QUALITY,positive
838,493514,493514:2,I cannot imagine you not rushing out to eat there.,NULL,RESTAURANT#GENERAL,positive
839,494850,494850:1,"During the course of the past 3 months, the chef and staff changed and it was not for the better.","chef,staff","FOOD#QUALITY,SERVICE#GENERAL","negative,negative"
840,494850,494850:2,I wish they would change back to what it was before.,NULL,RESTAURANT#GENERAL,negative
841,494850,494850:3,The food now is inconsistent.,food,FOOD#QUALITY,negative
842,496132,496132:0,This is the kind of place you'd like to take all your friends to and still keep a secret.,place,RESTAURANT#MISCELLANEOUS,positive
843,496132,496132:1,The setting is casual and romantic.,setting,AMBIENCE#GENERAL,positive
844,496132,496132:2,Prices are very good.,NULL,RESTAURANT#PRICES,positive
845,496132,496132:3,The food is excellent! ,food,FOOD#QUALITY,positive
846,496132,496132:4,"if you're daring, try the balsamic vinegar over icecream, it's wonderful!",balsamic vinegar over icecream,FOOD#QUALITY,positive
847,498657,498657:0,"Do not get the Go Go Hamburgers, no matter what the reviews say.",Go Go Hamburgers,FOOD#QUALITY,negative
848,498657,498657:1,They were such a rip-off ($8.95 for four small meat patties in steamed buns) and not worth trying.,"NULL,NULL,NULL","FOOD#QUALITY,FOOD#STYLE_OPTIONS,FOOD#PRICES","negative,negative,negative"
849,498657,498657:2,"The rest of the dim sum, though pricey by Chinatown standards, is worth it.","dim sum,dim sum","FOOD#PRICES,FOOD#QUALITY","negative,positive"
850,498657,498657:3,Steamed fresh so brought hot hot hot to your table.,NULL,FOOD#QUALITY,positive
851,498657,498657:4,"The wait here is long for dim sum, but if you don't like sharing tables or if the typical raucous dim sum atmosphere is not your gig, this is a sleek (for Chinatown) alternative.","wait,atmosphere,NULL","SERVICE#GENERAL,AMBIENCE#GENERAL,RESTAURANT#MISCELLANEOUS","negative,negative,negative"
852,498657,498657:5,"A few tips: skip the turnip cake, roast pork buns and egg custards.","turnip cake,roast pork buns,egg custards","FOOD#QUALITY,FOOD#QUALITY,FOOD#QUALITY","negative,negative,negative"
853,498657,498657:6,These are overpriced and you can get better just around the corner:,"NULL,NULL","FOOD#PRICES,FOOD#QUALITY","negative,negative"
854,503807,503807:1,I was pleasantly suprised.,NULL,RESTAURANT#GENERAL,positive
855,503807,503807:2,The food was exceptional.,food,FOOD#QUALITY,positive
856,503807,503807:4,"I choose to go with one of the special, the braised lamb shank in red wine, which was excellent.",braised lamb shank in red wine,FOOD#QUALITY,positive
857,503807,503807:5,The service was friendly and the atmosphere was casual.,"service,atmosphere","SERVICE#GENERAL,AMBIENCE#GENERAL","positive,neutral"
858,503807,503807:6,The restaurant is a bit noisy but that is something that can be overlooked once you sit down and enjoy a great meal,"meal,restaurant","FOOD#QUALITY,AMBIENCE#GENERAL","positive,neutral"
859,505535,505535:0,this little place has a cute interior decor and affordable city prices.,"interior decor,place","AMBIENCE#GENERAL,RESTAURANT#PRICES","positive,positive"
860,505535,505535:1,"the pad se ew chicken was delicious, however the pad thai was far too oily.","pad se ew chicken,pad thai","FOOD#QUALITY,FOOD#QUALITY","positive,negative"
861,507755,507755:0,"Have eaten at Ginger House several times, and it's always good.",Ginger House,RESTAURANT#GENERAL,positive
862,507755,507755:1,The fried dumplings are GREAT!,fried dumplings,FOOD#QUALITY,positive
863,507755,507755:2,Finally a reliable Chinese restaurant!,Chinese restaurant,RESTAURANT#GENERAL,positive
864,507844,507844:0,This place would be so much better served by being run by a group that actually understands customer service.,customer service,SERVICE#GENERAL,negative
865,507844,507844:1,"The only thing you can do here is walk in and eat .. but planning an event, especially a small, intimate one, forget about it.",NULL,RESTAURANT#MISCELLANEOUS,negative
866,507844,507844:2,"They are not helpful in the least and will give you the grand run around so by the time the event date rolls around you will not only regret chosing this place, but also become hostile!",NULL,SERVICE#GENERAL,negative
867,507844,507844:3,"Nobody at this restaurant will give firm answers about anything and in the end, not one person takes responsibility for anything.",NULL,SERVICE#GENERAL,negative
868,507844,507844:4,"Terrible, terrible management - deserves to be shut-down.","management,NULL","SERVICE#GENERAL,RESTAURANT#GENERAL","negative,negative"
869,507937,507937:0,Never fails to please.,NULL,RESTAURANT#GENERAL,positive
870,507937,507937:1,"delicious bagels, especially when right out of the oven.",bagels,FOOD#QUALITY,positive
871,507937,507937:2,Spreads and toppings are great - though a bit pricey.,"Spreads,toppings,Spreads,toppings","FOOD#QUALITY,FOOD#QUALITY,FOOD#PRICES,FOOD#PRICES","positive,positive,negative,negative"
872,507937,507937:3,Service is fast and friendly.,Service,SERVICE#GENERAL,positive
873,507937,507937:4,"Only drawback - they won't toast your bagel, and they don't make eggs for the bagel.",NULL,SERVICE#GENERAL,negative
874,507937,507937:5,But that is highly forgivable.,NULL,SERVICE#GENERAL,positive
875,509227,509227:0,"Been there, done that, and New York, it's not that big a deal.",NULL,RESTAURANT#GENERAL,neutral
876,509227,509227:1,"The food is decent at best, and the ambience, well, it's a matter of opinion, some may consider it to be a sweet thing, I thought it was just annoying.","food,ambience","FOOD#QUALITY,AMBIENCE#GENERAL","negative,negative"
877,509227,509227:2,"If celebrities make you sweat, then your in for a ride, but if your like most around these parts then you'll just yawn and wonder whats with all the hype.",NULL,RESTAURANT#MISCELLANEOUS,negative
878,509227,509227:3,"Rao is a good restaurant, but it's nothing special.",Rao,RESTAURANT#GENERAL,neutral
879,511290,511290:1,"But after last night, Spice Grill is the only place I'm eating indian cuisine.",indian cuisine,FOOD#QUALITY,positive
880,511290,511290:2,You must try the shrimp appetizers.,shrimp appetizers,FOOD#QUALITY,positive
881,511290,511290:3,Even my Indian friend couldn't believe how good and tasty everything was.,NULL,FOOD#QUALITY,positive
882,511290,511290:4,This place has the the correct ambience and an excellent staff to make you feel like a guest and a friend at the same time.,"ambience,staff","AMBIENCE#GENERAL,SERVICE#GENERAL","positive,positive"
883,512294,512294:0,"Great food, great prices, great service.","food,NULL,service","FOOD#QUALITY,RESTAURANT#PRICES,SERVICE#GENERAL","positive,positive,positive"
884,512294,512294:1,"If you are looking for a good quality, cheap eats - this is the place.","eats,eats","FOOD#QUALITY,FOOD#PRICES","positive,positive"
885,512925,512925:0,it's a perfect place to have a amanzing indian food.,indian food,FOOD#QUALITY,positive
886,512925,512925:1,I really loved the different and inovated touch that's the cheff gives to the food.,cheff,FOOD#STYLE_OPTIONS,positive
887,512925,512925:2,"also it's great to have dinner in a very romantic and confortable place, the service it's just perfect...they're so frendly that we never want to live the place!","place,service","AMBIENCE#GENERAL,SERVICE#GENERAL","positive,positive"
888,513395,513395:1,"Their bagels are fine, but they are a little overcooked, and not really a 'special' bagel experience.",bagels,FOOD#QUALITY,negative
889,513521,513521:0,Great bagels made the old-fashioned way.,"bagels,bagels","FOOD#QUALITY,FOOD#STYLE_OPTIONS","positive,positive"
890,513521,513521:2,Drawbacks: service is slow and they don't toast!,service,SERVICE#GENERAL,negative
891,519425,519425:0,The food was absolutely amazing!!,food,FOOD#QUALITY,positive
892,519425,519425:1,The baked clams octopus we shared as appetizers were the best we've ever had!! ,baked clams octopus,FOOD#QUALITY,positive
893,519425,519425:2,"The lamb was tender so full of flavor, the dessert was divine!!","lamb,dessert","FOOD#QUALITY,FOOD#QUALITY","positive,positive"
894,519425,519425:3,The waiter was attentive.,waiter,SERVICE#GENERAL,positive
895,519425,519425:4,The place itself is beautiful the bar scene seems to be happening.,"place,bar scene","AMBIENCE#GENERAL,AMBIENCE#GENERAL","positive,positive"
896,521916,521916:0,"Downtown Dinner 2002 - Prixe fix: Appetizers were ok, waiter gave me poor suggestion..try the potato stuff kanish best one.","Appetizers,waiter,potato stuff kanish","FOOD#QUALITY,SERVICE#GENERAL,FOOD#QUALITY","neutral,negative,positive"
897,521916,521916:1,"Small servings for main entree, i had salmon (wasnt impressed) girlfriend had chicken, it was good.","salmon,chicken,servings for main entree","FOOD#QUALITY,FOOD#QUALITY,FOOD#STYLE_OPTIONS","negative,positive,negative"
898,521916,521916:2,Dessert is a joke...dont bother,Dessert,FOOD#QUALITY,negative
899,527109,527109:0,"Volare virgins or weekly regulars, everyone gets treated the same and you can't ask for more than that when the service is this friendly.",service,SERVICE#GENERAL,positive
900,527109,527109:1,"The restaurant has a Family feel, not least with regard to the portions which are enormous; the veal alone could have single-handedly solved third world famine.","feel,portions,veal","AMBIENCE#GENERAL,FOOD#STYLE_OPTIONS,FOOD#STYLE_OPTIONS","positive,positive,positive"
901,527109,527109:2,"The anti-pasta was excellent, especially the calamari, as were the filling pasta mains.","anti-pasta,calamari,pasta mains,pasta mains","FOOD#QUALITY,FOOD#QUALITY,FOOD#QUALITY,FOOD#STYLE_OPTIONS","positive,positive,positive,positive"
902,527109,527109:3,The wine list is extensive and can easily hike up an otherwise reasonably priced meal.,"wine list,meal","DRINKS#STYLE_OPTIONS,FOOD#PRICES","positive,positive"
903,527109,527109:4,"Still, any quibbles about the bill were off-set by the pour-your-own measures of liquers which were courtesey of the house...","NULL,measures of liquers","RESTAURANT#PRICES,DRINKS#STYLE_OPTIONS","neutral,positive"
904,528251,528251:0,Fantastic place.,place,RESTAURANT#GENERAL,positive
905,528251,528251:1,Cute and decorative.,NULL,AMBIENCE#GENERAL,positive
906,528251,528251:2,A pleasant surprise.,NULL,RESTAURANT#GENERAL,positive
907,528251,528251:3,Go there to relax and feel like your somewhere else.,NULL,AMBIENCE#GENERAL,positive
908,530517,530517:0,Lucky Strike is a great casual place to just grab a bite to eat.,Lucky Strike,RESTAURANT#GENERAL,positive
909,530517,530517:2,"Great food, great decor, great service.","food,decor,service","FOOD#QUALITY,AMBIENCE#GENERAL,SERVICE#GENERAL","positive,positive,positive"
910,530517,530517:3,I recommend it!,NULL,RESTAURANT#GENERAL,positive
911,535086,535086:0,"This is the perfect spot for meeting friends, having lunch, dinner, pre-theatre or after-theatre drinks!",spot,RESTAURANT#MISCELLANEOUS,positive
912,535086,535086:1,(Always ask the bartender for the SEASONAL beer!!!,SEASONAL beer,DRINKS#QUALITY,positive
913,535086,535086:2,Guaranteed to be a tasty experience!),NULL,DRINKS#QUALITY,positive
914,535086,535086:3,Excellent spot for holiday get togethers with co-workers or friends that you haven't seen in a while.,spot,RESTAURANT#MISCELLANEOUS,positive
915,535086,535086:4,I have been doing all of the above at the Heartland Brewery for over 5 years now and I HAVE NEVER BEEN DISAPPOINTED!,Heartland Brewery,RESTAURANT#GENERAL,positive
916,535086,535086:5,All the people that I bring there go back on their own and bring THEIR friends!,NULL,RESTAURANT#MISCELLANEOUS,positive
917,535086,535086:6,Go there once and oh yes...you will go back...you will...,NULL,RESTAURANT#GENERAL,positive
918,535171,535171:0,What a great place!,place,RESTAURANT#GENERAL,positive
919,535171,535171:1,Not the typical NYC gimmick theme restaurant.,restaurant,AMBIENCE#GENERAL,positive
