,reviewID,sentenceID,review,target,category,polarity
1311,Z#9,Z#9:0,"short and sweet  seating is great:it's romantic,cozy and private.",seating,AMBIENCE#GENERAL,positive
1312,Z#9,Z#9:1,The boths are not as small as some of the reviews make them out to look they're perfect for 2 people.,boths,AMBIENCE#GENERAL,positive
1313,Z#9,Z#9:2,The service was extremely fast and attentive(thanks to the service button on your table) but I barely understood 1 word when the waiter took our order.,"service,service button,waiter","SERVICE#GENERAL,SERVICE#GENERAL,SERVICE#GENERAL","positive,positive,negative"
1314,Z#9,Z#9:3,The food was ok and fair nothing to go crazy.,food,FOOD#QUALITY,neutral
1315,Z#9,Z#9:5,Over all the looks of the place exceeds the actual meals.,"looks,meals","AMBIENCE#GENERAL,FOOD#QUALITY","positive,negative"
1316,Z#9,Z#9:6,So what you really end up paying for is the restaurant not the food.,"restaurant,restaurant,food","RESTAURANT#PRICES,AMBIENCE#GENERAL,FOOD#QUALITY","negative,neutral,negative"
1317,Z#9,Z#9:7,Will prob. not return but it is a great dinning experience to try atleast once.,"NULL,NULL","RESTAURANT#GENERAL,RESTAURANT#GENERAL","negative,positive"
1318,NP#3,NP#3:0,Impressed...,NULL,RESTAURANT#GENERAL,positive
1319,NP#3,NP#3:1,Subtle food and service,"food,service","FOOD#QUALITY,SERVICE#GENERAL","positive,positive"
1320,NP#3,NP#3:2,Noodle pudding is exactly the type of service and food I enjoy.,"service,food","SERVICE#GENERAL,FOOD#QUALITY","positive,positive"
1321,NP#3,NP#3:3,"Servers are all different, Greg is my favorite.",Greg,SERVICE#GENERAL,positive
1322,NP#3,NP#3:4,"Sometimes tables don't understand his sense of humor but it's refreshing to have a server who has personality, professionalism, and respects the privacy of your dinner.",server,SERVICE#GENERAL,positive
1323,NP#3,NP#3:5,This is the first place I've been that a runner remembers my order... hope he likes his job because I have half a mind to steal him for my restaurant.,runner,SERVICE#GENERAL,positive
1324,NP#3,NP#3:6,Prices are fair across the board for both food and bev.,"food,bev","FOOD#PRICES,DRINKS#PRICES","positive,positive"
1325,NP#3,NP#3:7,"I go out to eat and like my courses, servers are patient and never rush courses or force another drink.",servers,SERVICE#GENERAL,positive
1326,BHD#7,BHD#7:0,amazing fresh dogs but best of all endless toppings!!!,"dogs,toppings","FOOD#QUALITY,FOOD#STYLE_OPTIONS","positive,positive"
1327,BHD#7,BHD#7:1,this place had ALL the trimmings and i mean all.,trimmings,FOOD#STYLE_OPTIONS,positive
1328,BHD#7,BHD#7:2,"peppers, onions, relish, chilli, cheeses, you NAME it.",NULL,FOOD#STYLE_OPTIONS,positive
1329,BHD#7,BHD#7:3,amazing fun for hot dog lovers of all ages PLEASE do yourself a favor and check this place out!!!!,"place,hot dog","RESTAURANT#GENERAL,FOOD#QUALITY","positive,positive"
1330,CLF#5,CLF#5:0,BEST DINING EXPERIENCE IN THE WEST VILLAGE!,NULL,RESTAURANT#GENERAL,positive
1331,CLF#5,CLF#5:1,Stepping into Casa La Femme last night was a true experience unlike any other in New York!,Casa La Femme,RESTAURANT#GENERAL,positive
1332,CLF#5,CLF#5:2,Highly impressed from the decor to the food to the hospitality to the great night I had!,"decor,food,NULL,NULL","AMBIENCE#GENERAL,FOOD#QUALITY,SERVICE#GENERAL,RESTAURANT#GENERAL","positive,positive,positive,positive"
1333,CLF#5,CLF#5:3,The have a great cocktail with Citrus Vodka and lemon and lime juice and mint leaves that is to die for!,cocktail with Citrus Vodka and lemon and lime juice and mint leaves,DRINKS#QUALITY,positive
1334,CLF#5,CLF#5:4,"Food took some time to prepare, all worth waiting for.","Food,NULL","FOOD#QUALITY,SERVICE#GENERAL","positive,neutral"
1335,CLF#5,CLF#5:5,We were drawn into the belly dancing show that captivated the crowd.,belly dancing show,AMBIENCE#GENERAL,positive
1336,CLF#5,CLF#5:6,I never write on these sites but this restaurant is def worth commending!,restaurant,RESTAURANT#GENERAL,positive
1337,CLF#5,CLF#5:7,Great find in the West Village!,NULL,RESTAURANT#GENERAL,positive
1338,NP#4,NP#4:0,Maggot in the food!,food,FOOD#QUALITY,negative
1339,NP#4,NP#4:2,"The menu looked great, and the waiter was very nice, but when the food came, it was average.","menu,waiter,food","FOOD#STYLE_OPTIONS,SERVICE#GENERAL,FOOD#QUALITY","positive,positive,neutral"
1340,NP#4,NP#4:3,"Nevertheless, I finished my plate, and that's when I found a maggot in mushroom sauce at the bottom.",mushroom sauce,FOOD#QUALITY,negative
1341,NP#4,NP#4:4,"I showed it to the manager, and he smilingly apologized and brought us two free desserts (but did not ask us what we wanted and so brought the last two desserts we would have asked for).","manager,manager","SERVICE#GENERAL,SERVICE#GENERAL","positive,negative"
1342,NP#4,NP#4:5,"When the bill came, nothing was comped, so I told the manager very politely that we were willing to pay for the wine, but I didn't think I should have to pay for food with a maggot in it.",NULL,SERVICE#GENERAL,negative
1343,NP#4,NP#4:7,"The manager finally said he would comp the two glasses of wine (which cost less than the food), and made it seem like a big concession.",manager,SERVICE#GENERAL,negative
1344,NP#4,NP#4:8,We paid and left because we didn't feel like arguing any more.,NULL,SERVICE#GENERAL,negative
1345,NP#4,NP#4:9,"I have worked in restaurants and cook a lot, and there is no way a maggot should be able to get into well prepared food.",food,FOOD#QUALITY,negative
1346,NP#4,NP#4:10,"For a restaurant with such a good reputation and that is usually so packed, there was no reason for such a lack of intelligent customer service.","restaurant,customer service","RESTAURANT#MISCELLANEOUS,SERVICE#GENERAL","positive,negative"
1347,P#6,P#6:0,Unhygienic,NULL,FOOD#QUALITY,negative
1348,P#6,P#6:1,I do not recommend.,NULL,RESTAURANT#GENERAL,negative
1349,P#6,P#6:3,I got hair in my food 2 times of then !,food,FOOD#QUALITY,negative
1350,BzG#2,BzG#2:0,"Great place, great value.","place,place","RESTAURANT#GENERAL,RESTAURANT#PRICES","positive,positive"
1351,BzG#2,BzG#2:1,"The food is flavorful, plentiful and reasonably priced.","food,food,food","FOOD#QUALITY,FOOD#STYLE_OPTIONS,FOOD#PRICES","positive,positive,positive"
1352,BzG#2,BzG#2:2,The atmosphere is relaxed and casual.,atmosphere,AMBIENCE#GENERAL,positive
1353,BzG#2,BzG#2:3,It's a great place to order from or sit-in.,place,RESTAURANT#MISCELLANEOUS,positive
1354,TVU#4,TVU#4:0,Awesome,NULL,RESTAURANT#GENERAL,positive
1355,TVU#4,TVU#4:1,"Inexpensive, unassuming, great time!","NULL,NULL","RESTAURANT#PRICES,RESTAURANT#GENERAL","positive,positive"
1356,Z#2,Z#2:0,Sushi experience was unbelievable with my fiance.,Sushi,FOOD#QUALITY,positive
1357,Z#2,Z#2:1,Try it!,NULL,RESTAURANT#GENERAL,positive
1358,Z#2,Z#2:2,Very pleased,NULL,RESTAURANT#GENERAL,positive
1359,Y#9,Y#9:0,Good creative rolls!,"rolls,rolls","FOOD#QUALITY,FOOD#STYLE_OPTIONS","positive,positive"
1360,Y#9,Y#9:1,"Yamato is an excellent place to go if youre not into sashimi, or if you have friends who doesnt like sushi much.",Yamato,RESTAURANT#MISCELLANEOUS,positive
1361,Y#9,Y#9:2,"They have great rolls, the triple color and norwegetan rolls, are awesome and filling.","rolls,triple color and norwegetan rolls,triple color and norwegetan rolls","FOOD#QUALITY,FOOD#QUALITY,FOOD#STYLE_OPTIONS","positive,positive,positive"
1362,Y#9,Y#9:3,"One special roll and one regular roll is enough to fill you up, but save room for dessert!","dessert,special roll,regular roll","FOOD#QUALITY,FOOD#STYLE_OPTIONS,FOOD#STYLE_OPTIONS","positive,positive,positive"
1363,Y#9,Y#9:4,"They have a delicious banana chocolate dessert, as well as a great green tea tempura.","banana chocolate dessert,green tea tempura","FOOD#QUALITY,FOOD#QUALITY","positive,positive"
1364,Y#9,Y#9:5,The appetizers are also delicious!,appetizers,FOOD#QUALITY,positive
1365,Z#5,Z#5:0,Amazing food.,food,FOOD#QUALITY,positive
1366,Z#5,Z#5:1,Mazing interior.,interior,AMBIENCE#GENERAL,negative
1367,Z#5,Z#5:2,Great food!,food,FOOD#QUALITY,positive
1368,Z#5,Z#5:3,I've had my fair share of modern Japanese and this spot delivers.,modern Japanese,FOOD#QUALITY,positive
1369,Z#5,Z#5:4,"The atmosphere was pretty nice but had a bit lacking, which it tries to make up for with a crazy scheme of mirrors.","atmosphere,scheme of mirrors","AMBIENCE#GENERAL,AMBIENCE#GENERAL","negative,negative"
1370,Z#5,Z#5:5,"If you're into being lost when you're just five feet from your table then hey, that's a good thing.",NULL,AMBIENCE#GENERAL,negative
1371,Z#5,Z#5:6,Despite the confusing mirrors this will likely be my go-to for modern Japanese food for the foreseeable future.,"modern Japanese food,mirrors","FOOD#QUALITY,AMBIENCE#GENERAL","positive,negative"
1372,TM#4,TM#4:0,"Indo Chinese food, pretty good...",Indo Chinese food,FOOD#QUALITY,positive
1373,TM#4,TM#4:1,Not a very fancy place but very good Chinese style Indian food.,"place,Chinese style Indian food","AMBIENCE#GENERAL,FOOD#QUALITY","neutral,positive"
1374,TM#4,TM#4:2,"The chicken lollipop is my favorite, most of the dishes (I have to agree with a previous reviewer) are quite oily and very spicy, espeically the Chilli Chicken.","chicken lollipop,dishes,Chilli Chicken","FOOD#QUALITY,FOOD#QUALITY,FOOD#QUALITY","positive,negative,negative"
1375,TM#4,TM#4:3,"My mom originally introduced me to this place, but even she (being Indian) feels the food can be somewhat over the top spicy and far too oily.",food,FOOD#QUALITY,negative
1376,TM#4,TM#4:4,Still we keep going back :),NULL,RESTAURANT#GENERAL,positive
1377,TFS#11,TFS#11:0,I was speechless by the horrible food.,food,FOOD#QUALITY,negative
1378,TFS#11,TFS#11:1,"I attended a holiday dinner at the restaurant, and the food was majorly disappointing.",food,FOOD#QUALITY,negative
1379,TFS#11,TFS#11:3,"Rather than preparing vegetarian dish, the chef presented me with a plate of steamed vegetables (minus sauce, seasoning, or any form or aesthetic presentation).","chef,vegetarian dish,vegetarian dish","SERVICE#GENERAL,FOOD#QUALITY,FOOD#STYLE_OPTIONS","negative,negative,negative"
1380,TFS#11,TFS#11:4,"I was so stunned, and I left the dinner hungry and majorly disappointing.",NULL,RESTAURANT#GENERAL,negative
1381,TFS#11,TFS#11:5,This place survives on reputation alone.,place,RESTAURANT#MISCELLANEOUS,negative
1382,TFS#11,TFS#11:6,I will NEVER return.,NULL,RESTAURANT#GENERAL,negative
1383,ADLT#10,ADLT#10:0,Best In ALL of NYC,NULL,RESTAURANT#GENERAL,positive
1384,ADLT#10,ADLT#10:1,"This is the MOST wonderful restaurant in all of New York City, not just Brooklyn...",restaurant,RESTAURANT#GENERAL,positive
1385,ADLT#10,ADLT#10:2,"for 7 years they have put out the most tasty, most delicious food and kept it that way...",food,FOOD#QUALITY,positive
1386,ADLT#10,ADLT#10:3,"never swaying, never a bad meal, never bad service...","NULL,meal,service","RESTAURANT#GENERAL,FOOD#QUALITY,SERVICE#GENERAL","positive,positive,positive"
1387,ADLT#10,ADLT#10:5,you should travel from the Bronx to try it...,NULL,RESTAURANT#GENERAL,positive
1388,ADLT#10,ADLT#10:6,"great food, great wine list, great service in a great neighborhood...","food,wine list,service,neighborhood","FOOD#QUALITY,DRINKS#STYLE_OPTIONS,SERVICE#GENERAL,LOCATION#GENERAL","positive,positive,positive,positive"
1389,ADLT#10,ADLT#10:7,so delicious!!!!!!,NULL,FOOD#QUALITY,positive
1390,PP#3,PP#3:0,Patsy's Pizza = true love,Patsy's Pizza,RESTAURANT#GENERAL,positive
1391,PP#3,PP#3:1,Hands down the best pizza on the planet.,pizza,FOOD#QUALITY,positive
1392,PP#3,PP#3:3,"In about 12 minutes, the thing is gone.",NULL,FOOD#QUALITY,positive
1393,BHD#6,BHD#6:0,great hot dogs..,hot dogs,FOOD#QUALITY,positive
1394,BHD#6,BHD#6:1,the hot dogs were juicy and tender inside and had plenty of crunch and snap on the outside.,hot dogs,FOOD#QUALITY,positive
1395,BHD#6,BHD#6:2,great toppings definitely a place you need to check out for late night munchies or a mid day boost!,"toppings,place","FOOD#QUALITY,RESTAURANT#MISCELLANEOUS","positive,positive"
1396,TM#5,TM#5:0,great taste,NULL,FOOD#QUALITY,positive
1397,TM#5,TM#5:1,"Great, original taste.",NULL,FOOD#QUALITY,positive
1398,TM#5,TM#5:2,"For me dishes a little oily, but overall dining experience good.","dishes,NULL","FOOD#QUALITY,RESTAURANT#GENERAL","negative,positive"
1399,TM#5,TM#5:3,Helpful service and average price per dish $10.,"service,dish","SERVICE#GENERAL,FOOD#PRICES","positive,positive"
1400,TM#5,TM#5:4,The only thing that strikes you is the decor?(not very pleasant).,decor,AMBIENCE#GENERAL,negative
1401,TM#6,TM#6:0,great food,food,FOOD#QUALITY,positive
1402,TM#6,TM#6:1,This place has great indian chinese food.,indian chinese food,FOOD#QUALITY,positive
1403,TM#6,TM#6:2,The flavors are amazing and the value is phenomenal.,"NULL,NULL","FOOD#QUALITY,FOOD#PRICES","positive,positive"
1404,TM#6,TM#6:3,"Be prepared to wait, because the place is pretty tiny.",place,RESTAURANT#MISCELLANEOUS,negative
1405,TM#6,TM#6:4,"Also, they do not take credit card so come with cash!",NULL,RESTAURANT#MISCELLANEOUS,neutral
1406,TM#6,TM#6:5,"Even though the place is not beautiful, the food speaks for itself.","place,food","AMBIENCE#GENERAL,FOOD#QUALITY","negative,positive"
1407,TM#6,TM#6:6,"Best Indian Chinese in the city, by far!",Indian Chinese,FOOD#QUALITY,positive
1408,TVU#6,TVU#6:0,AMAZING MY FAVORITE!!!,NULL,RESTAURANT#GENERAL,positive
1409,TVU#6,TVU#6:2,"I came across Village Underground by accident, now I go there all the time.",Village Underground,RESTAURANT#GENERAL,positive
1410,TVU#6,TVU#6:3,The martinis are amazing and very fairly priced.,"martinis,martinis","DRINKS#QUALITY,DRINKS#PRICES","positive,positive"
1411,TVU#6,TVU#6:4,"THE SERVICE IS AMAZING, i've had different waiters and they were all nice, which is a rare thing in NYC.","SERVICE,waiters","SERVICE#GENERAL,SERVICE#GENERAL","positive,positive"
1412,TVU#6,TVU#6:5,"The DJ is awesome, I have been there for my birthday and a bunch of other times with friends and I keep going back.","DJ,NULL","AMBIENCE#GENERAL,RESTAURANT#GENERAL","positive,positive"
1413,TVU#6,TVU#6:6,You can get a table without a reservation if you get there early I they don't make you by bottles.,NULL,SERVICE#GENERAL,positive
1414,TVU#6,TVU#6:7,Which lets face it....at times it's a good thing.,NULL,SERVICE#GENERAL,positive
1415,TVU#6,TVU#6:8,In the end you end up with a fair tab and NOTHING BUT A GREAT TIME!!!,"NULL,NULL","RESTAURANT#PRICES,RESTAURANT#GENERAL","positive,positive"
1416,TVU#6,TVU#6:9,Highly recommended!,NULL,RESTAURANT#GENERAL,positive
1417,ADLT#3,ADLT#3:0,"One of the best, if not THE best, restaurants in Park Slope (and NY in general)",NULL,RESTAURANT#GENERAL,positive
1418,ADLT#3,ADLT#3:1,Everything on the menu is great. ,menu,FOOD#QUALITY,positive
1419,ADLT#3,ADLT#3:2,This establishment is the real deal. ,establishment,RESTAURANT#GENERAL,positive
1420,ADLT#3,ADLT#3:3,"Wish NY had more of these kind of places: intimate, superb food, homey, top notch all the way around, certainly worth the wait.","NULL,food,NULL","AMBIENCE#GENERAL,FOOD#QUALITY,RESTAURANT#GENERAL","positive,positive,positive"
1421,TFS#5,TFS#5:2,But $500 for a dinner for two that didn't include Wine?,dinner for two,FOOD#PRICES,negative
1422,TFS#5,TFS#5:4,"Look, the appetizers were really good.",appetizers,FOOD#QUALITY,positive
1423,TFS#5,TFS#5:5,The entree was also very good.,entree,FOOD#QUALITY,positive
1424,TFS#5,TFS#5:6,"Can't argue about that, but they are clearly over priced.",NULL,FOOD#PRICES,negative
1425,TFS#5,TFS#5:7,What you are paying for is the environment and the name.,"environment,NULL,NULL","AMBIENCE#GENERAL,RESTAURANT#MISCELLANEOUS,RESTAURANT#PRICES","neutral,neutral,negative"
1426,TFS#5,TFS#5:8,"Yes, the place is classy and beautiful, but they most certainly target the uber whealthy Not the common joe that wants to go all out every once in a while.","place,place","AMBIENCE#GENERAL,RESTAURANT#PRICES","positive,negative"
1427,TFS#5,TFS#5:12,Which of course is not real Kobe but Wagyu beef.,NULL,FOOD#QUALITY,negative
1428,TFS#5,TFS#5:13,Surprised that a place of this caliber would advertise it as Kobe.,NULL,RESTAURANT#MISCELLANEOUS,negative
1429,TFS#5,TFS#5:16,Vanison was good but not amazing.,Vanison,FOOD#QUALITY,neutral
1430,TFS#5,TFS#5:17,Bison was quite excellent however.,Bison,FOOD#QUALITY,positive
1431,TFS#5,TFS#5:18,Dessert: pure disaster.,Dessert,FOOD#QUALITY,negative
1432,TFS#5,TFS#5:19,Just not good at all.,NULL,FOOD#QUALITY,negative
1433,TFS#5,TFS#5:20,Some Pineapple covered in a glaze of some kind and some pear tart thing Not impressive at all.,"NULL,NULL","FOOD#STYLE_OPTIONS,FOOD#QUALITY","negative,negative"
1434,TFS#5,TFS#5:21,"I read reviews that called the restaurant too expensive and I thought to myself, but may be it is worth it.","restaurant,restaurant","RESTAURANT#PRICES,RESTAURANT#GENERAL","negative,negative"
1435,TFS#5,TFS#5:23,"The Four Seasons has history and it is a sort of landmark of New York City restaurants, but trust me, they will charge you through the nose just so that you can say ""I've been to the four seasons restaurant"".","The Four Seasons,The Four Seasons","RESTAURANT#MISCELLANEOUS,RESTAURANT#PRICES","neutral,negative"
1436,TFS#5,TFS#5:24,"I wanted to go there to see if it was worth it and sadly, curiousity got the best of me and I paid dearly for it.","NULL,NULL","RESTAURANT#GENERAL,RESTAURANT#PRICES","negative,negative"
1437,TFS#5,TFS#5:25,"All in all, the food was great (except for the dessserts).","food,dessserts","FOOD#QUALITY,FOOD#QUALITY","positive,negative"
1438,TFS#5,TFS#5:26,The environment is very upscale and you will see a lot of rich guys with trophy wives or just highly paid escorts.,"environment,NULL","AMBIENCE#GENERAL,RESTAURANT#MISCELLANEOUS","neutral,neutral"
1439,TFS#5,TFS#5:27,"If you are going for the food, it will not be worth it.",food,FOOD#QUALITY,negative
1440,TFS#5,TFS#5:29,"You would think they would make up for it with service, sadly, no.",service,SERVICE#GENERAL,negative
1441,TFS#5,TFS#5:30,"Service was just ok, it is not what you'd expect for $500.","Service,NULL","SERVICE#GENERAL,RESTAURANT#PRICES","negative,negative"
1442,CLF#3,CLF#3:0,Terrible Waste of money.. scammers,"NULL,NULL","RESTAURANT#GENERAL,RESTAURANT#PRICES","negative,negative"
1443,CLF#3,CLF#3:1,I agree that dining at Casa La Femme is like no other dining experience!,Casa La Femme,RESTAURANT#GENERAL,negative
1444,CLF#3,CLF#3:3,I am actually offended to have spent so much money on such a bad experience.,"NULL,NULL","RESTAURANT#GENERAL,RESTAURANT#PRICES","negative,negative"
1445,CLF#3,CLF#3:4,I literally just got back home after visiting Casa La Femme and was so offended by my visit felt it necessary to try and warn other diners who value their money and time.,"Casa La Femme,Casa La Femme","RESTAURANT#GENERAL,RESTAURANT#PRICES","negative,negative"
1446,CLF#3,CLF#3:6,"Our visit their to say the least, was an unpleasant and costly experience!","NULL,NULL","RESTAURANT#GENERAL,RESTAURANT#PRICES","negative,negative"
1447,CLF#3,CLF#3:7,And even more so unpleasant because it was so costly for such an unpleasant experience.,"NULL,NULL","RESTAURANT#GENERAL,RESTAURANT#PRICES","negative,negative"
1448,CLF#3,CLF#3:8,We did arrive late for our reservation so I can not complain too much about the wait for a table.,wait,SERVICE#GENERAL,neutral
1449,CLF#3,CLF#3:9,Although we were told 10-15 minutes and it was more like 45 minutes.,NULL,SERVICE#GENERAL,negative
1450,CLF#3,CLF#3:10,We were ushered to the bar to wait momentarily and upon arrival were so excited.,NULL,RESTAURANT#GENERAL,positive
1451,CLF#3,CLF#3:11,The place is beautiful!,place,AMBIENCE#GENERAL,positive
1452,CLF#3,CLF#3:12,The hostess was very pleasant.,hostess,SERVICE#GENERAL,positive
1453,CLF#3,CLF#3:13,"However, our $14 drinks were were horrible!","drinks,drinks","DRINKS#QUALITY,DRINKS#PRICES","negative,negative"
1454,CLF#3,CLF#3:14,"Once we finally got a table, despite indicating we wanted an alla carte menu we were pushed into a table that was only price fixed!",NULL,SERVICE#GENERAL,negative
1455,CLF#3,CLF#3:16,Our experience did not ever get any better.,NULL,RESTAURANT#GENERAL,negative
1456,CLF#3,CLF#3:17,For each course we waited over 1/2 hour to 45 minutes and were never offered a drink.,NULL,SERVICE#GENERAL,negative
1457,CLF#3,CLF#3:18,We also asked for Hooka six times and the waiter kept telling us one minute and never returning with the Hooka.,waiter,SERVICE#GENERAL,negative
1458,CLF#3,CLF#3:19,After the 4th time i asked again and the waiter than said after our dinner.,waiter,SERVICE#GENERAL,negative
1459,CLF#3,CLF#3:20,We asked for beverages and never received them.,NULL,SERVICE#GENERAL,negative
1460,CLF#3,CLF#3:21,We asked for sides which the waiter than admitted that he forgot to put in that part of our order.,waiter,SERVICE#GENERAL,negative
1461,CLF#3,CLF#3:22,My chicken was inedible as there were so many fatty lumps which i had to keep spitting out into my napkin.,chicken,FOOD#QUALITY,negative
1462,CLF#3,CLF#3:23,I would not expect this for a $55 dinner.,"dinner,dinner","FOOD#QUALITY,FOOD#PRICES","negative,negative"
1463,CLF#3,CLF#3:24,By the time we finished our dinner we still had not received one beverage NOR hooka!,NULL,SERVICE#GENERAL,negative
1464,CLF#3,CLF#3:25,What we did do was waste 3 hours being trapped in a table waiting and waiting for food and drinks and hooka.. some of which we never received!,NULL,SERVICE#GENERAL,negative
1465,CLF#3,CLF#3:26,The only beverage we did receive was water in dirty glasses!,NULL,SERVICE#GENERAL,negative
1466,CLF#3,CLF#3:27,To top it all off.. the main reason we came to your restaurant was for the belly dancers and missed the first show as we were not seated yet and the 2nd belly dancer only danced at two tables in the back of the restaurant and never made it around to the other half of the restaurant.,"NULL,NULL","SERVICE#GENERAL,RESTAURANT#MISCELLANEOUS","negative,negative"
1467,CLF#3,CLF#3:28,"By the time we left our wallets were empy and so were our stomachs AND we missed the show we were supposed to see following our dinner, which would have been acceptable if we got to enjoy the experience of good food and belly dancers!","food,NULL,NULL","FOOD#QUALITY,RESTAURANT#PRICES,RESTAURANT#MISCELLANEOUS","negative,negative,negative"
1468,CLF#3,CLF#3:29,If it seemed possible to do so while there I would have fought my bill since my dinner portion of my meal was inedible!,"meal,NULL","FOOD#QUALITY,RESTAURANT#PRICES","negative,negative"
1469,CLF#3,CLF#3:30,"I have never left a restaurant feeling as if i was abused, and wasted my hard earned money.","restaurant,restaurant","RESTAURANT#GENERAL,RESTAURANT#PRICES","negative,negative"
1470,CLF#3,CLF#3:31,MY husbands birthday and my sons was not as it was intended... and we drove two hours to spend too much money to be treated terribly!,"NULL,NULL,NULL","RESTAURANT#GENERAL,RESTAURANT#PRICES,SERVICE#GENERAL","negative,negative,negative"
1471,CLF#3,CLF#3:32,I wish I COULD be refunded!,NULL,RESTAURANT#GENERAL,negative
1472,BFC#9,BFC#9:0,Don't go with a larger group than 4! ,NULL,RESTAURANT#MISCELLANEOUS,negative
1473,BFC#9,BFC#9:4,"At first we were a little taken aback, as this seemed to present a problem, although the restaurant looked fairly empty, but they hastily put the table together for us.",NULL,SERVICE#GENERAL,positive
1474,BFC#9,BFC#9:5,The menu is fairly simple without much descriptions. ,menu,FOOD#STYLE_OPTIONS,neutral
1475,BFC#9,BFC#9:6,"There was no tap beer that evening, which was a disappointment. ",beer,DRINKS#STYLE_OPTIONS,negative
1476,BFC#9,BFC#9:7,"Not much of a selection of bottled beer either, we went with Brahma. ",selection of bottled beer,DRINKS#STYLE_OPTIONS,negative
1477,BFC#9,BFC#9:8,The appetizers we ordered were served quickly - an order of fried oysters and clams were delicious but a tiny portion (maybe 3 of each). ,"fried oysters and clams,fried oysters and clams,NULL","FOOD#QUALITY,FOOD#STYLE_OPTIONS,SERVICE#GENERAL","positive,negative,positive"
1478,BFC#9,BFC#9:9,"The lobster knuckles (special of the day) were ok, but pretty tasteless.","lobster knuckles,lobster knuckles","FOOD#STYLE_OPTIONS,FOOD#QUALITY","neutral,negative"
1479,BFC#9,BFC#9:10,"I believe there were 2 shrimp in the ""salt encrusted shrimp"" appetizer. ","""salt encrusted shrimp"" appetizer",FOOD#STYLE_OPTIONS,negative
1480,BFC#9,BFC#9:14,"She replied ""well it would be more convenient for us if you ordered now, since you are a larger party, and it might get crowded."" ",NULL,SERVICE#GENERAL,negative
1481,BFC#9,BFC#9:16,The food arrived in about 15 minutes. ,NULL,SERVICE#GENERAL,neutral
1482,BFC#9,BFC#9:17,I had the Thai style Fried Sea Bass...which was very good. ,Thai style Fried Sea Bass,FOOD#QUALITY,positive
1483,BFC#9,BFC#9:18,"Everyone seemed generally happy with their food, except my brother who had the grilled Mahi Mahi, seemingly drenched in Grapfruit Juice! ","food,grilled Mahi Mahi,grilled Mahi Mahi","FOOD#QUALITY,FOOD#QUALITY,FOOD#STYLE_OPTIONS","positive,negative,negative"
1484,BFC#9,BFC#9:19,I heard the lobster roll was excellent. ,lobster roll,FOOD#QUALITY,positive
1485,BFC#9,BFC#9:20,"They seemed to continue to rush us along, taking plates without asking if we were done (my sister still had her fork in hand). ",NULL,SERVICE#GENERAL,negative
1486,BFC#9,BFC#9:21,"All in all the food was good - a little on the expensive side, but fresh. ","food,food","FOOD#QUALITY,FOOD#PRICES","positive,negative"
1487,BFC#9,BFC#9:22,"Service not the friendliest to our ""large party""! ",Service,SERVICE#GENERAL,negative
1488,BFC#9,BFC#9:23,Probably would not go back here.,NULL,RESTAURANT#GENERAL,negative
1489,BG#5,BG#5:0,Great Indian food,Indian food,FOOD#QUALITY,positive
1490,BG#5,BG#5:2,"Food was amazing - I love Indian food and eat it quite regularly, but I can say this is one of the best I've had.",Food,FOOD#QUALITY,positive
1491,BG#5,BG#5:3,"Very ""normal Indian food"", but done really well.","Indian food,Indian food","FOOD#STYLE_OPTIONS,FOOD#QUALITY","neutral,positive"
