,id,review,opinion,label,predict,predict2
0,1221938:0,the drinks are always welll made and wine selection is fairly priced.,welll,positive,positive,negative
1,1615322:2,they have authentic indian at amazin prices.,indian,positive,positive,negative
2,1655504:4,wine list is extensive without being over-priced.,extensive,positive,positive,negative
3,527109:3,the wine list is extensive and can easily hike up an otherwise reasonably priced meal.,extensive,positive,positive,negative
4,TM#5:3,helpful service and average price per dish $10.,average,positive,positive,negative
