,id,review,target,label,predict,term,polarity
165,1353599:0,right off the l in brooklyn this is a nice cozy place with good pizza.,"pizza,place","FOOD,AMBIENCE",AMBIENCE,place,"positive,positive"
166,1353599:2,my friend got the mushroom pizza which tasted better.,mushroom pizza,FOOD,FOOD,better|room,positive
167,1353599:3,the sangria was pretty tasty and good on a hot muggy day.,sangria,FOOD,FOOD,tasty,positive
168,1357554:0,i started out with a bombay beer which was big enough for two.,Bombay beer,FOOD,,,positive
169,1357554:4,it's a nice place to relax and have conversation.,place,AMBIENCE,AMBIENCE,place,positive
170,1367358:1,the food is authentic italian - delicious!,food,FOOD,FOOD,food|delicious,positive
171,1367358:2,"pizza is terrific, as is homemade pasta.","Pizza,homemade pasta","FOOD,FOOD",,,"positive,positive"
172,1367358:3,"ambience is delightful, service impeccable.","Ambience,service","AMBIENCE,SERVICE",AMBIENCE,ambience|service|light,"positive,positive"
173,1380450:0,i'm still mad that i had to pay for lousy food.,food,FOOD,FOOD,food,negative
174,1380450:1,the hanger steak was like rubber and the tuna was flavorless not to mention it tasted like it had just been thawed.,"hanger steak,tuna","FOOD,FOOD",,,"negative,negative"
175,1380450:2,service was also horrible and the ambience is not that great.,"Service,ambience","SERVICE,AMBIENCE",AMBIENCE,ambience|great|service|also,"negative,negative"
176,1387314:1,this is my first time writing a review for a restaurant because the food and service was excellent.,"food,service","FOOD,SERVICE",SERVICE,food|service|restaurant|time,"positive,positive"
177,1387314:2,the filet mignon dish was superb!,filet mignon dish,FOOD,FOOD,dish,positive
178,1387314:4,it's a small cute restaurant.,restaurant,AMBIENCE,AMBIENCE,small|restaurant,positive
179,1390357:2,"i like the ambience, it's very dark and original.",ambience,AMBIENCE,AMBIENCE,ambience,positive
180,1390357:4,the sushi is amazing!!!,sushi,FOOD,FOOD,sushi,positive
181,1394712:0,very affordable and excellent ambient!,"ambient,NULL","AMBIENCE,PRICES",,,"positive,positive"
182,1394712:1,we ordered some beef and noodle soup dishes from the thai section of the menu but nothing we got was thai.,beef and noodle soup dishes,FOOD,FOOD,dish|order,negative
183,1394712:3,we won't go to this place again for a good meal.,meal,FOOD,FOOD,place|meal,negative
184,1394712:4,"however, i think this place is a good hang out spot.",place,AMBIENCE,AMBIENCE,place,positive
185,1395421:1,the pizza and wine were excellent-the service too--but what really made this place was the backyard dining area.,"Pizza,wine,service,backyard dining area","FOOD,FOOD,SERVICE,AMBIENCE",AMBIENCE,place|back|service|really|area|real|wine,"positive,positive,positive,positive"
186,1398844:0,"first of all, this place is *not* romantic, as claimed by citysearch's editorial review.",place,AMBIENCE,AMBIENCE,place,negative
187,1398844:3,slightly above average wines start at $70+ with only one selection listed at $30+.,"wines,wines","FOOD,PRICES",PRICES,light|wine,"negative,negative"
188,1398844:4,service is not what one would expect from a joint in this price category.,Service,SERVICE,PRICES,rice|would|service|expect,negative
189,1398844:6,somehow working the italian charm with constant mille grazie does not constitute proper service.,service,SERVICE,SERVICE,service,negative
190,1404042:1,not one of our meals was edible - bland and/or made with weird rosemary or orange flavoring.,"meals,rosemary or orange flavoring","FOOD,FOOD",FOOD,rose|meal,"negative,negative"
191,1404042:2,fish was overdone.,Fish,FOOD,,,negative
192,1404042:3,"cute place, nice wait staff but would never go there again.","wait staff,place,place","SERVICE,AMBIENCE",SERVICE,place|would|staff,"positive,positive,negative"
193,1404042:4,someone else recommended the dessert - we also left that.,dessert,FOOD,FOOD,also|else|recommended|someone|left|dessert,negative
194,1404042:5,one of us actually liked the expresso - that's it.,expresso,FOOD,PRICES,actually,positive
195,1410878:1,i've never had bad service and the fish is fresh and delicious.,"service,fish","SERVICE,FOOD",FOOD,service|delicious,"positive,positive"
196,1410878:2,their tuna tartar appetizer is to die for.,tuna tartar appetizer,FOOD,,,positive
197,1413697:0,"i come from a family of pizzeria owners, and i'm almost ashamed to say that the pizza in fornino's blows my families receipies away.",pizza,FOOD,SERVICE,away|come,positive
198,1413697:2,the place is so cool and the service is prompt and curtious.,"service,place","SERVICE,AMBIENCE",SERVICE,place|service,"positive,positive"
199,1417496:0,a restaurant that doesn't try to do anything except serve great food with great service in a pleasant atmosphere.,"food,service,atmosphere","FOOD,SERVICE,AMBIENCE",AMBIENCE,food|great|great|service|restaurant|atmosphere|pleasant,"positive,positive,positive"
200,1417496:1,no gimmicks here -- the food speaks for itself in its freshness and preparation.,food,FOOD,FOOD,food,positive
201,1417496:2,the dining room is quietly elegant with no music to shout over -- how refreshing!,dining room,AMBIENCE,SERVICE,room|quiet,positive
202,1417496:3,"the service was impeccable and unobtrusive -- the staff knows what they are there to do -- to know their menu, present your meal, and attend to your needs.","service,staff","SERVICE,SERVICE",SERVICE,service|staff|tend|meal,"positive,positive"
203,1417496:4,"looking around, i saw a room full of new yorkers enjoying a real meal in a real restaurant, not a clubhouse of the fabulous trying to be seen.","meal,restaurant","FOOD,AMBIENCE",SERVICE,restaurant|room|real|real|trying|seen|meal|full|fabulous,"positive,positive"
204,1430994:0,the view is breathtaking the service is top notch... the ambiance is wonderfull.,"view,service,ambiance","AMBIENCE,SERVICE,AMBIENCE",SERVICE,service|full,"positive,positive,positive"
205,1430994:1,the staff offers impeccable service.,staff,SERVICE,SERVICE,service|staff,positive
206,1430994:2,i had lobster bisque it has 2 oz. of maine lobster in it.,Lobster Bisque,FOOD,,,positive
207,1430994:3,my boyfriend had the new england chowder it was good but i think the award should go to the lobster bisque.,"New England Chowder,Lobster Bisque","FOOD,FOOD",,,"positive,positive"
208,1430994:6,my boyfriend had prime rib it was good .,Prime Rib,FOOD,,,positive
209,1430994:7,we didn't want a bottle of bubbly on a weekday so we each got little bottles of korbett it was just enough.,bottles of Korbett,FOOD,FOOD,little|week,positive
210,1431154:0,my wife and i ate here earlier this week and have not stopped ranting and raving about the food.,food,FOOD,FOOD,food|week,positive
211,1431154:1,if you like spicy food get the chicken vindaloo.,chicken vindaloo,FOOD,FOOD,food,positive
212,1432551:0,go to volare for 1st class service and terrific food.,"service,food","SERVICE,FOOD",SERVICE,food|service,"positive,positive"
213,1439875:1,"the place is small and intimate and you may feel a little crowded, but the service is excellent and it's great for friends out, a romantic date, or a special occassion.","service,place,place","SERVICE,AMBIENCE",AMBIENCE,place|little|small|great|service|date,"positive,negative,positive"
214,1439875:3,the food can get pricey but the prixe fixe tasting menu is the greatest food for a good price and they cater the food to any food allergies or food you don't like.,"food,prixe fixe tasting menu,prixe fixe tasting menu,NULL","PRICES,FOOD,PRICES,SERVICE",FOOD,food|food|food|food|food|great|rice|rice|fixe|prix,"negative,positive,positive,positive"
215,1451107:0,this place is so much fun.,place,AMBIENCE,AMBIENCE,place|much,positive
216,1451107:6,the staff was the friendliest that have seen in new york.,staff,SERVICE,SERVICE,staff|seen,positive
217,1457607:0,the place is a lot of fun.,place,AMBIENCE,AMBIENCE,place,positive
218,1457607:2,the characters really make for an enjoyable experience.,characters,AMBIENCE,PRICES,really|character|make|real,positive
219,1457607:4,it is very overpriced and not very tasty.,"NULL,NULL","FOOD,PRICES",FOOD,tasty|rice,"negative,negative"
220,1459569:1,service was slow had to wait to order and get food although not crowded.,Service,SERVICE,SERVICE,food|service|order,negative
221,1459569:2,drinks way over priced.,Drinks,PRICES,PRICES,rice,negative
222,1460715:1,service was quick.,Service,SERVICE,SERVICE,service,positive
223,1470286:1,delivery is fast too.,Delivery,SERVICE,,,positive
224,1471273:3,prices too high for this cramped and unappealing resturant.,"resturant,resturant","PRICES,AMBIENCE",PRICES,rice,"negative,negative"
225,1471273:4,zero ambiance to boot.,ambiance,AMBIENCE,,,negative
226,1476493:3,"when you add it all together, it just doesn't seem worth it to me...especially considering the prices.","NULL,NULL",PRICES,PRICES,rice,"negative,negative"
227,1486041:0,"the atmosphere is nothing special, but it feels like a sushi establishment in tokyo.",atmosphere,AMBIENCE,FOOD,sushi|atmosphere,positive
228,1486041:1,the owner and staff are all japanese as well and that adds to the entire ambiance.,"owner,staff,ambiance",AMBIENCE,SERVICE,staff|well,"positive,positive,positive"
229,1490757:2,the prices were cheap compared to the quality of service and food.,"NULL,service,food","PRICES,SERVICE,FOOD",PRICES,food|rice|service,"positive,positive,positive"
230,1500453:1,this quaint and romantic trattoria is at the top of my manhattan restaurant list.,"trattoria,trattoria",AMBIENCE,SERVICE,restaurant,"positive,positive"
231,1506491:0,"i have known about this secret for the last 13 years, emilio(the godfather) has continued to serve food and wine for the gods at mortal prices.","food,wine,food,wine","FOOD,FOOD,PRICES,PRICES",FOOD,food|rice|wine,"positive,positive,positive,positive"
232,1506491:2,check out the secret back room.,back room,AMBIENCE,SERVICE,back|room,positive
233,1538149:0,"i found the food, service and value exceptional everytime i have been there.","food,service,NULL","FOOD,SERVICE,PRICES",FOOD,food|service|time|every|found,"positive,positive,positive"
234,1538149:3,the service was excellent - friendly and attentive.,service,SERVICE,SERVICE,service|friendly,positive
235,1543345:3,great staff.,staff,SERVICE,SERVICE,great|staff,positive
236,1543345:4,always great service!,service,SERVICE,SERVICE,great|service|always,positive
237,1561259:1,but the staff was so horrible to us.,staff,SERVICE,SERVICE,staff,negative
238,1561259:2,the hostess and the waitress were incredibly rude and did everything they could to rush us out.,"hostess,waitress","SERVICE,SERVICE",PRICES,rush|every,"negative,negative"
239,1561259:3,we were planning to get dessert but the waitress basically through the bill at us before we had a chance to order.,waitress,SERVICE,FOOD,planning|order|dessert,negative
240,1561259:4,"this place is pricey, and yes, the food is worth it; but the service makes you feel like you should be paying a quater of the price.","place,food,service","PRICES,FOOD,SERVICE",PRICES,place|food|rice|rice|service|make,"negative,positive,negative"
241,1572027:3,i ate here a week ago and found most dishes average at best and too expensive.,"dishes,dishes","FOOD,PRICES",PRICES,dish|week|best|found|expensive,"negative,negative"
242,1586174:6,the waitstaffs are nice though.,waitstaffs,SERVICE,,staff|waitstaff,positive
243,1603698:2,"both times i was extremely dissappointed by the service, which was boarderline rude.",service,SERVICE,SERVICE,service|time,negative
244,1606837:2,the service was attentive.,service,SERVICE,SERVICE,service,positive
245,1609375:3,"try the pad thai, it's fabulous and their prices are so cheap!","Pad Thai,NULL","FOOD,PRICES",PRICES,rice|fabulous,"positive,positive"
246,1609375:4,"just because it's cheap does not mean the portions are small or the food is nasty, it is great!","portions,food,NULL","FOOD,FOOD,PRICES",FOOD,food|small|great,"positive,positive,positive"
247,1611489:1,"also, the sandwiches (nearing $7) didn't come with anything like chips or a side.","sandwiches,sandwiches","FOOD,PRICES",PRICES,also|come,"negative,negative"
248,1611489:2,"overall, not worth the money.","NULL,NULL",PRICES,PRICES,money,"negative,negative"
249,1615322:2,they have authentic indian at amazin prices.,"Indian,Indian","FOOD,PRICES",PRICES,rice,"positive,positive"
250,1615322:4,the seats are uncomfortable if you are sitting against the wall on wooden benches.,seats,AMBIENCE,AMBIENCE,table|wall|sitting,negative
251,1615322:5,it's a rather cramped and busy restaurant and it closes early.,"restaurant,restaurant",AMBIENCE,SERVICE,restaurant,"negative,negative"
252,1623276:0,patroon features a nice cigar bar and has great staff.,"cigar bar,staff","AMBIENCE,SERVICE",SERVICE,great|staff,"positive,positive"
253,1626564:3,waitstaff are very friendly.,Waitstaff,SERVICE,SERVICE,staff|friendly|waitstaff,positive
254,1632445:3,the service is good and ambience is good for a date or group outing.,"service,ambience","SERVICE,AMBIENCE",AMBIENCE,ambience|service|group|date,"positive,positive"
255,1632445:4,the only fallback on this restaurant is the prices.,restaurant,PRICES,PRICES,rice|back|restaurant,negative
256,1632445:6,the lobster sandwich is $24 and although it was good it was not nearly enough to warrant that price.,"lobster sandwich,lobster sandwich,lobster sandwich","FOOD,FOOD,PRICES",PRICES,rice|nearly,"positive,negative,negative"
257,1632929:4,"when my dessert came, there was a candle in it - not because anyone asked for one - but because the waiter must have seen me opening my birthday card and gift, and said he knew it was a special occassion of some sort.",waiter,SERVICE,SERVICE,sort|knew|asked|seen|dessert,positive
258,1632929:5,truly the mark of an attentive waiter.,waiter,SERVICE,PRICES,mark|truly,positive
259,1649025:2,the food is so cheap and the waiters are nice.,"food,waiters","PRICES,SERVICE",FOOD,food,"positive,positive"
260,1655504:1,cheese plate is a varied delight and great bargain at $10.,"Cheese plate,Cheese plate,Cheese plate","FOOD,FOOD,PRICES",FOOD,varied|great|plate|bargain|light,"positive,positive,positive"
261,1655504:4,wine list is extensive without being over-priced.,"Wine list,Wine list","FOOD,PRICES",FOOD,rice|wine,"positive,positive"
262,1655521:1,i almost hesititate to write a review because the atmosphere was so great and i would hate for it too become to crowded.,atmosphere,AMBIENCE,AMBIENCE,hate|great|become|write|would|come|atmosphere,positive
263,1655521:2,"the food was very good, a great deal, and the place its self was great.","food,food,place","FOOD,PRICES,AMBIENCE",FOOD,place|food|great|great,"positive,positive,positive"
264,1655521:3,"the wait staff is very freindly, they make it feel like you're eating in a freindly little european town.",wait staff,SERVICE,SERVICE,little|staff|make,positive
265,1660047:1,"the service was terrible, we had to wait for everything and ask several of different people for the same thing before we were allowed to be served.",service,SERVICE,SERVICE,service|served|every,negative
266,1660047:2,"the waitress, seems to be more concerned of looking good than actually waitressing.",waitress,SERVICE,PRICES,actually,negative
267,1660047:3,"after dinner the manager grabbed my boyfriend, asked him: where are you from...maybe you dont know how things work in america...and in the end stormed away almost teareyed yelling that tips are the only thing they survive on.",manager,SERVICE,SERVICE,asked|away|dinner|maybe,negative
268,1660047:4,"we did tip, i guess the model/waitress just wanted more and complained to the manager.",waitress,SERVICE,,,negative
269,1661043:4,decor is charming.,Decor,AMBIENCE,,,positive
270,1661757:2,"the ambience was so fun, and the prices were great, on top of the fact that the food was really tasty.","ambience,NULL,food","AMBIENCE,PRICES,FOOD",FOOD,food|tasty|ambience|great|rice|really|real,"positive,positive,positive"
271,1662726:0,i was here a few weeks back and we had the worst customer service experience at a restaurant ever.,customer service,SERVICE,SERVICE,back|customer|service|restaurant|week,negative
272,1662726:1,"a gentleman, maybe the manager, came to our table, and without so much as a smile or greeting asked for our order.",gentleman,SERVICE,SERVICE,asked|much|table|gentleman|order|maybe|smile,negative
273,1671113:1,the food is great and reasonably priced.,"food,food","FOOD,PRICES",PRICES,food|great|rice,"positive,positive"
274,1671113:2,"i have tried to make reservations, but both times, the hostess didn't have my name.",hostess,SERVICE,PRICES,time|make|reservation,negative
275,1671113:3,"if the weather is nice, try to snag an outside table.",outside table,AMBIENCE,SERVICE,table,positive
276,1671113:4,"the staff has been nice, but they seemed really stressed and the unisex bathroom needs to be cleaned more often.","staff,staff,unisex bathroom","SERVICE,SERVICE,AMBIENCE",SERVICE,really|staff|room|real,"positive,negative,negative"
277,1700205:2,"considering we were the last patrons there and it was after the closing time, the waitstaff did not rush us at all and made us feel comfortable and relaxed.",waitstaff,SERVICE,SERVICE,staff|table|closing|time|patron|waitstaff|rush,positive
278,1702257:3,friendly staff that actually lets you enjoy your meal and the company you're with.,staff,SERVICE,SERVICE,actually|staff|friendly|meal,positive
279,1706644:4,"we ate out in the back patio, which is worth it as it's cool and the music is hear well there.","back patio,music","AMBIENCE,AMBIENCE",AMBIENCE,back|well,"positive,positive"
280,1707201:2,the place was nice and calm.,place,AMBIENCE,AMBIENCE,place,positive
281,1707201:3,but the service was a bit slow.,service,SERVICE,SERVICE,service,negative
282,1707741:3,service was also very good.,Service,SERVICE,SERVICE,service|also,positive
283,1718513:3,"the back garden sitting area is very pleasant, where you can see their personal herb garden.",back garden sitting area,AMBIENCE,AMBIENCE,back|garden|garden|sitting|pleasant|personal|area,positive
284,1726001:3,a great choice at any cost and a great deal.,"NULL,NULL",PRICES,AMBIENCE,great|great,"positive,positive"
285,1727363:1,this is a wonderful place on all stand points especially value ofr money.,"place,place",PRICES,PRICES,place|money,"positive,positive"
286,1727363:2,an excellent service,service,SERVICE,SERVICE,service,positive
287,1728733:1,we were greeted promptly by the waiter who was very nice and cordial.,waiter,SERVICE,,,positive
288,1730127:2,"always a nice crowd, but never loud.","crowd,NULL",AMBIENCE,SERVICE,always,"positive,positive"
289,1748813:1,all of the pizzas are terrific and the price is even better!,"pizzas,pizzas","FOOD,PRICES",PRICES,rice|better,"positive,positive"
290,1748839:1,"immediately after we paid, the waiter took the money and said, okay, you guys are outta here.",waiter,SERVICE,PRICES,money,negative
291,404464:3,i expected quite a bit more from such an expensive menu.,"menu,menu","PRICES,FOOD",PRICES,expect|expensive,"negative,negative"
292,426930:0,authentic taiwanese food that's cheap... what more could you ask for?,"Taiwanese food,Taiwanese food","FOOD,PRICES",FOOD,food,"positive,positive"
293,430342:1,"kind, attentive wait staff.",wait staff,SERVICE,SERVICE,staff,positive
294,433878:3,the counter service is bad.,counter service,SERVICE,SERVICE,service,negative
295,436868:2,"the sandwiches are dry, tasteless and way overpriced.","sandwiches,sandwiches","FOOD,PRICES",PRICES,rice,"negative,negative"
296,436868:3,"calling the place hampton chutney co. does warn you that these folks offer more style than substance, but in this unattractive room with unhelpful clerks there was a dearth of the former too.","place,room,clerks","AMBIENCE,SERVICE",AMBIENCE,place|dearth|room|former|warn|unattractive|unhelpful,"negative,negative,negative"
297,445960:0,"this is such a lovely, peaceful place to eat outside.",place,AMBIENCE,AMBIENCE,place,positive
298,445960:1,the restaurant looks out over beautiful green lawns to the hudson river and the statue of liberty.,restaurant,AMBIENCE,SERVICE,restaurant,positive
299,445960:4,"this is a great place to take out-of-towners, and perfect for watching the sunset.",place,AMBIENCE,AMBIENCE,place|great,positive
300,449802:5,but who says murray's is anything about service.,service,SERVICE,SERVICE,service,negative
301,454704:1,the service is awful.,service,SERVICE,SERVICE,service,negative
302,454704:2,this place is not worth the prices.,"place,place",PRICES,PRICES,place|rice,"negative,negative"
303,464342:1,i asked for an open faced cheese sandwich and the manager basically told me to take my business elsewhere!,manager,SERVICE,SERVICE,asked|else,negative
304,475298:0,"good, fast service.",service,SERVICE,SERVICE,service,positive
305,475298:2,food is great and inexpensive.,"Food,Food","FOOD,PRICES",FOOD,food|great|expensive,"positive,positive"
306,475298:3,the location is perfect.,location,AMBIENCE,AMBIENCE,location,positive
307,475512:2,"well, this place is so ghetto its not even funny.",place,AMBIENCE,AMBIENCE,place|well,negative
308,475512:3,if you like your music blasted and the system isnt that great and if you want to pay at least 100 dollar bottle minimun then you'll love it here.,"bottle minimun,music","PRICES,AMBIENCE",AMBIENCE,great,"negative,negative"
309,476473:2,great atmoshere and worth every bit.,"atmoshere,NULL",AMBIENCE,AMBIENCE,great|every,"positive,positive"
310,483111:0,winnie and her staff are the best crew you can find serving you.,"staff,Winnie","SERVICE,SERVICE",SERVICE,staff|winnie|serving|find|best,"positive,positive"
311,485767:1,"the service was attentive, yet discreet.",service,SERVICE,SERVICE,service,positive
312,485966:1,the place was quiet and delightful.,place,AMBIENCE,AMBIENCE,place|light|quiet,positive
313,490565:1,"the wait staff is pleasant, fun, and for the most part gorgeous (in the wonderful aesthetic beautification way, not in that she's-way-cuter-than-me-that-b@#$* way).",wait staff,SERVICE,SERVICE,staff|pleasant,positive
314,490565:3,"but the best part about ls is the late night atmosphere, delightfully free of the bts.",late night atmosphere,AMBIENCE,AMBIENCE,light|atmosphere|best|full|night,positive
315,490565:4,"you can get a completely delish martini in a glass (that's about 2 1/2 drinks) for $8.50 (i recommend the vanilla shanty, mmmm!) in a great homey setting with great music.","martini,martini,martini,Vanilla Shanty,setting,music","FOOD,FOOD,PRICES,FOOD,AMBIENCE,AMBIENCE",AMBIENCE,great|great|glass,"positive,positive,positive,positive,positive,positive"
316,490565:5,"the in-house lady dj on saturday nights has outrageously good taste in music, and moreover, takes requests.",in-house lady DJ,AMBIENCE,AMBIENCE,night,positive
317,493013:1,"its location is good and the fact that hutner college is near and their prices are very reasonable, makes students go back to suan again and again.","location,Suan","AMBIENCE,PRICES",PRICES,rice|back|location|make,"positive,positive"
318,493013:6,in summer-eat outside on a terrace (another great feature of suan)!!!,terrace,AMBIENCE,AMBIENCE,great,positive
319,493514:0,i cannot imagine a friendlier staff working in a restaurant.,staff,SERVICE,SERVICE,staff|restaurant,positive
320,496132:1,the setting is casual and romantic.,setting,AMBIENCE,,,positive
321,498657:1,they were such a rip-off ($8.95 for four small meat patties in steamed buns) and not worth trying.,"NULL,NULL,NULL","FOOD,FOOD,PRICES",AMBIENCE,small|trying,"negative,negative,negative"
322,498657:4,"the wait here is long for dim sum, but if you don't like sharing tables or if the typical raucous dim sum atmosphere is not your gig, this is a sleek (for chinatown) alternative.","wait,atmosphere,NULL","SERVICE,AMBIENCE",AMBIENCE,table|atmosphere,"negative,negative,negative"
323,498657:6,these are overpriced and you can get better just around the corner:,"NULL,NULL","PRICES,FOOD",PRICES,rice|better,"negative,negative"
324,505535:0,this little place has a cute interior decor and affordable city prices.,"interior decor,place","AMBIENCE,PRICES",PRICES,place|little|rice,"positive,positive"
325,507844:0,this place would be so much better served by being run by a group that actually understands customer service.,customer service,SERVICE,PRICES,place|much|would|better|customer|service|actually|group|understands|served,negative
326,507844:4,"terrible, terrible management - deserves to be shut-down.","management,NULL",SERVICE,,,"negative,negative"
327,507937:2,spreads and toppings are great - though a bit pricey.,"Spreads,toppings,Spreads,toppings","FOOD,FOOD,PRICES,PRICES",PRICES,great|rice,"positive,positive,negative,negative"
328,507937:3,service is fast and friendly.,Service,SERVICE,SERVICE,service|friendly,positive
329,511290:4,this place has the the correct ambience and an excellent staff to make you feel like a guest and a friend at the same time.,"ambience,staff","AMBIENCE,SERVICE",AMBIENCE,place|ambience|staff|time|make,"positive,positive"
330,512294:0,"great food, great prices, great service.","food,NULL,service","FOOD,PRICES,SERVICE",PRICES,food|great|great|great|rice|service,"positive,positive,positive"
331,512294:1,"if you are looking for a good quality, cheap eats - this is the place.","eats,eats","FOOD,PRICES",AMBIENCE,place,"positive,positive"
332,512925:2,"also it's great to have dinner in a very romantic and confortable place, the service it's just perfect...they're so frendly that we never want to live the place!","place,service","AMBIENCE,SERVICE",SERVICE,place|place|great|service|also|table|dinner,"positive,positive"
333,513521:2,drawbacks: service is slow and they don't toast!,service,SERVICE,PRICES,back|service,negative
334,519425:3,the waiter was attentive.,waiter,SERVICE,,,positive
335,519425:4,the place itself is beautiful the bar scene seems to be happening.,"place,bar scene","AMBIENCE,AMBIENCE",AMBIENCE,place,"positive,positive"
