,id,review,target,label,predict,term,polarity
0,1004293:1,"we, there were four of us, arrived at noon - the place was empty - and the staff acted like we were imposing on them and they were very rude.",staff,SERVICE,SERVICE,place|staff,negative
1,1004293:3,the food was lousy - too sweet or too salty and the portions tiny.,"food,portions","FOOD,FOOD",FOOD,food,"negative,negative"
2,1014458:0,"i have eaten at saul, many times, the food is always consistently, outrageously good.",food,FOOD,FOOD,food|always|time,positive
3,1014458:2,the duck confit is always amazing and the foie gras terrine with figs was out of this world.,"foie gras terrine with figs,duck confit","FOOD,FOOD",FOOD,always|gras|foie,"positive,positive"
4,1014458:3,the wine list is interesting and has many good values.,"wine list,wine list","FOOD,PRICES",FOOD,wine,"positive,positive"
5,1014458:4,"for the price, you cannot eat this well in manhattan.","NULL,NULL","PRICES,FOOD",PRICES,rice|well,"positive,positive"
6,1016296:1,ive asked a cart attendant for a lotus leaf wrapped rice and she replied back rice and just walked away.,cart attendant,SERVICE,SERVICE,rice|rice|back|attendant|replied|walked|cart|asked|away|lotus|wrapped|tend,negative
7,1016296:4,chow fun was dry; pork shu mai was more than usually greasy and had to share a table with loud and rude family.,"Chow fun,pork shu mai,NULL","FOOD,FOOD",SERVICE,table,"negative,negative,negative"
8,1028246:1,"service was devine, oysters where a sensual as they come, and the price can't be beat!!!","Service,oysters,NULL","SERVICE,FOOD,PRICES",PRICES,rice|service|come,"positive,positive,positive"
9,1032695:1,"everything is always cooked to perfection, the service is excellent, the decor cool and understated.","NULL,service,decor","FOOD,SERVICE,AMBIENCE",SERVICE,service|always|every,"positive,positive,positive"
10,1032695:2,i had the duck breast special on my last visit and it was incredible.,duck breast special,FOOD,,,positive
11,1041457:2,"the food is very average...the thai fusion stuff is a bit too sweet, every thing they serve is too sweet here.","food,Thai fusion stuff,NULL","FOOD,FOOD,FOOD",FOOD,food|every,"negative,negative,negative"
12,1041457:3,the only thing i moderately enjoyed was their grilled chicken special with edamame puree.,Grilled Chicken special with Edamame Puree,FOOD,,,positive
13,1041457:4,i had never had edamame pureed before but i thought it was innovative and tasty (could've used a bit more salt).,"Edamame pureed,Edamame pureed","FOOD,FOOD",FOOD,tasty,"positive,positive"
14,1041457:6,"the decor is night tho...but they really need to clean that vent in the ceiling...its quite un-appetizing, and kills your effort to make this place look sleek and modern.","place,decor,vent","AMBIENCE,AMBIENCE,AMBIENCE",AMBIENCE,place|really|make|real|night,"negative,positive,negative"
15,1053543:2,"their sake list was extensive, but we were looking for purple haze, which wasn't listed but made for us upon request!","sake list,NULL","FOOD,SERVICE",FOOD,sake,"positive,positive"
16,1053543:3,"the spicy tuna roll was unusually good and the rock shrimp tempura was awesome, great appetizer to share!","spicy tuna roll,rock shrimp tempura","FOOD,FOOD",AMBIENCE,great,"positive,positive"
17,1053543:4,we went around 9:30 on a friday and it had died down a bit by then so the service was great!,service,SERVICE,SERVICE,great|service,positive
18,1055910:2,food-awesome.,Food,FOOD,,food,positive
19,1055910:3,service- friendly and attentive.,Service,SERVICE,SERVICE,service|friendly,positive
20,1055910:4,ambiance- relaxed and stylish.,Ambiance,AMBIENCE,,,positive
21,1058221:3,"however, it's the service that leaves a bad taste in my mouth.",service,SERVICE,SERVICE,service,negative
22,1058221:4,"i happen to have a policy that goes along with a little bit of self-respect, which includes not letting a waiter intimidate me, i.e. make me feel bad asking for trivialities like water, or the check.",waiter,SERVICE,PRICES,little|date|make,negative
23,1062641:2,food is great.,Food,FOOD,FOOD,food|great,positive
24,1062641:3,service is top notch.,Service,SERVICE,SERVICE,service,positive
25,1064477:0,"i tend to judge a sushi restaurant by its sea urchin, which was heavenly at sushi rose.",sea urchin,FOOD,FOOD,restaurant|sushi|sushi|tend|rose|urchin|judge,positive
26,1064477:2,the sushi seemed pretty fresh and was adequately proportioned.,"sushi,sushi","FOOD,FOOD",FOOD,sushi,"positive,positive"
27,1064477:3,the rice to fish ration was also good--they didn't try to overpack the rice.,rice to fish ration,FOOD,FOOD,rice|rice|also,positive
28,1064477:4,we took advanatage of the half price sushi deal on saturday so it was well worth it.,"half price sushi deal,half price sushi deal","FOOD,PRICES",PRICES,rice|sushi|well,"positive,positive"
29,1074868:4,the food was well prepared and the service impecable.,"food,service","FOOD,SERVICE",SERVICE,food|service|well,"positive,positive"
30,1084394:3,the prix fixe menu is worth every penny and you get more than enough (both in quantity and quality).,"Prix Fixe menu,Prix Fixe menu,Prix Fixe menu","FOOD,FOOD,PRICES",SERVICE,fixe|prix|every,"positive,positive,positive"
31,1086415:1,"it is terrific, as is the value.","NULL,NULL","FOOD,PRICES",,,"positive,positive"
32,1086415:2,"$6 and there is much tasty food, all of it fresh and continually refilled.","food,food,food","FOOD,FOOD,PRICES",FOOD,food|tasty|much,"positive,positive,positive"
33,1086415:3,"i am not a vegetarian but, almost all the dishes were great.",dishes,FOOD,FOOD,great|dish,positive
34,1086478:1,"i like the somosas, chai, and the chole, but the dhosas and dhal were kinda dissapointing.","somosas,chai,chole,dhosas,dhal","FOOD,FOOD,FOOD,FOOD,FOOD",,,"positive,positive,positive,negative,negative"
35,1086478:2,"the service varys from day to day- sometimes they're very nice, and sometimes not.",service,SERVICE,SERVICE,service|time|time,negative
36,1086478:3,"the kitchen however, is almost always slow.",kitchen,SERVICE,SERVICE,always,negative
37,1086478:4,"also, specify if you like your food spicy- its rather bland if you don't.",food,FOOD,FOOD,food|also,negative
38,1086478:5,"the ambience is pretty and nice for conversation, so a casual lunch here would probably be best.","ambience,NULL",AMBIENCE,AMBIENCE,ambience|would|best,"positive,positive"
39,1090587:1,if you've ever been along the river in weehawken you have an idea of the top of view the chart house has to offer.,view,AMBIENCE,,,positive
40,1090587:2,add to that great service and great food at a reasonable price and you have yourself the beginning of a great evening.,"service,food,food","SERVICE,FOOD,PRICES",PRICES,food|great|great|great|rice|service|evening,"positive,positive,positive"
41,1090587:3,the lava cake dessert was incredible and i recommend it.,lava cake dessert,FOOD,FOOD,dessert,positive
42,1102681:0,"once you step into cosette, you're miraculously in a small, off-the-beaten path parisian bistro.",Cosette,AMBIENCE,FOOD,small|step|miraculously|cosette|bistro,positive
43,1102681:1,"this tiny restaurant is as cozy as it gets, with that certain parisian flair.",restaurant,AMBIENCE,SERVICE,restaurant,positive
44,1102681:2,"the food was average to above-average; the french onion soup filling yet not overly impressive, and the desserts not brilliant in any way.","food,French Onion soup,French Onion soup,desserts","FOOD,FOOD,FOOD,FOOD",FOOD,food|dessert,"positive,negative,positive,negative"
45,1118167:2,the pizza was delivered cold and the cheese wasn't even fully melted!,"pizza,cheese","FOOD,FOOD",PRICES,full,"negative,negative"
46,1119578:1,the pizza is overpriced and soggy.,"pizza,pizza","FOOD,PRICES",PRICES,rice,"negative,negative"
47,1119578:2,"yes, they use fancy ingredients, but even fancy ingredients don't make for good pizza unless someone knows how to get the crust right.","ingredients,pizza,crust","FOOD,FOOD,FOOD",PRICES,make|someone,"positive,negative,negative"
48,1123262:0,i think i've had some the best meals of my life at minnow.,meals,FOOD,FOOD,best|meal,positive
49,1123262:1,"the seafood is amazing, there's a good wine list, and the ever-changing menu always offers some great surprises.","seafood,wine list,menu","FOOD,FOOD,FOOD",FOOD,food|great|always|wine,"positive,positive,positive"
50,1123262:2,the combination of super-fresh ingredients in the dishes are unusual but really delicious.,ingredients,FOOD,FOOD,really|dish|combination|real|delicious,positive
51,1125006:1,best pastrami i ever had and great portion without being ridiculous.,"Pastrami,portion","FOOD,FOOD",AMBIENCE,great|best,"positive,positive"
52,1125006:3,my wife had the fried shrimp which are huge and loved it.,"fried shrimp,fried shrimp","FOOD,FOOD",,,"positive,positive"
53,1125284:2,"the signs, the specials menus, food, and even all the waitstaff are all totally japanese.","signs,specials menus,food,waitstaff","FOOD,FOOD,SERVICE",FOOD,food|staff|waitstaff,"positive,positive,positive,positive"
54,1126814:0,"leon is an east village gem: casual but hip, with well prepared basic french bistro fare, good specials, a warm and lively atmosphere.","Leon,Leon,specials,atmosphere,French bistro fare","AMBIENCE,FOOD,AMBIENCE,FOOD",AMBIENCE,bistro|atmosphere|well,"positive,positive,positive,positive,positive"
55,1126814:1,"my wife and i always enjoy the young, not always well trained but nevertheless friendly, staff, all of whom have a story.",staff,SERVICE,SERVICE,always|always|staff|friendly|well,positive
56,1126886:2,"the service is excellent, the decor is great, and the food is delicious and comes in large portions.","service,decor,food,portions","SERVICE,AMBIENCE,FOOD,FOOD",FOOD,food|great|service|come|delicious,"positive,positive,positive,positive"
57,1131595:2,the hostess is rude to the point of being offensive.,hostess,SERVICE,,,negative
58,1131595:3,the food was bland oily.,food,FOOD,FOOD,food,negative
59,1138996:1,"we have been to this place many times, and always have great food, wine, and service.","food,wine,service","FOOD,FOOD,SERVICE",SERVICE,place|food|great|service|always|time|wine,"positive,positive,positive"
60,1138996:2,"we were worried we would have trouble getting in, but somehow managed to have a short wait.",wait,SERVICE,PRICES,would,positive
61,1138996:3,as always we had a great glass of wine while we waited.,glass of wine,FOOD,FOOD,great|always|glass|wine,positive
62,1138996:4,"when we sat, we got great and fast service.",service,SERVICE,SERVICE,great|service,positive
63,1138996:5,the people that work there are always so friendly you forget you are in new york sometimes.,people,SERVICE,AMBIENCE,always|friendly|time,positive
64,1145510:1,the pizza is yummy and i like the atmoshpere.,"pizza,atmoshpere","FOOD,AMBIENCE",,,"positive,positive"
65,1145510:2,but the pizza is way to expensive.,pizza,PRICES,PRICES,expensive,negative
66,1145510:3,"a large is $20, and toppings are about $3 each.","NULL,toppings","PRICES,PRICES",,,"negative,negative"
67,1147082:0,i went there for lunch and it was not as good as i expected from the reviews i read.,lunch,FOOD,PRICES,expect,negative
68,1147082:1,sauce was watery and the food didn't have much flavor.,"Sauce,food","FOOD,FOOD",FOOD,food|much,"negative,negative"
69,1147211:2,the waitress was very patient with us and the food is phenomenal!,"waitress,food","SERVICE,FOOD",FOOD,food,"positive,positive"
70,1147211:3,"service was prompt, friendly and great.",Service,SERVICE,SERVICE,great|service|friendly,positive
71,1153034:0,great pizza and fantastic service.,"pizza,service","FOOD,SERVICE",SERVICE,great|service,"positive,positive"
72,1153034:1,"there was a small wait, but shorter than i expected.",wait,SERVICE,PRICES,small|expect,positive
73,1153034:2,located at the end of a magnificent block.,block,AMBIENCE,,,positive
74,1154550:0,this is the best sushi in new york city - hands down.,sushi,FOOD,FOOD,sushi|best,positive
75,1154550:2,get the tuna of gari.,tuna of gari,FOOD,,,positive
76,1162037:0,"planet thailand has always been a hit with me , i go there usually for the sushi, which is great , the thai food is excellent too .","sushi,thai food,Planet Thailand","FOOD,FOOD",FOOD,food|great|always|sushi,"positive,positive,positive"
77,1162037:1,"with the great variety on the menu , i eat here often and never get bored .",menu,FOOD,AMBIENCE,great,positive
78,1162037:3,it's all about the food !!,food,FOOD,FOOD,food,positive
79,1167434:3,"but when we looked at the menu, there weren't a lot of choices, most of them were dumplings in the appetizer section.",menu,FOOD,,,negative
80,1175958:1,"try the crunchy tuna, it is to die for.",crunchy tuna,FOOD,,,positive
81,1189674:0,first went here to enjoy their garden terrace.,garden terrace,AMBIENCE,AMBIENCE,garden,positive
82,1189674:1,"the food was amazing, and the service was prompt and helpful, but not over-bearing or rushed.","food,service","FOOD,SERVICE",SERVICE,food|service|rush,"positive,positive"
83,1189674:2,"the steak tartare is a great bet, they fix it for you at the table.",Steak Tartare,FOOD,SERVICE,great|table,positive
84,1189674:4,"great wine selection, gigondas is worth the price, and the house champagne is a great value.","wine selection,Gigondas,house champagne","FOOD,FOOD,PRICES",PRICES,great|great|rice|wine,"positive,positive,positive"
85,1199292:0,"pizza - the only pizza in nyc that should not have additional toppings - the crust tastes like the best, freshly baked bread!","crust,pizza","FOOD,FOOD",PRICES,best,"positive,positive"
86,1199480:0,"not sure where the previous reviewer, lonk, dined, but saul is in a great neighborhood and has great food!","neighborhood,food","AMBIENCE,FOOD",FOOD,sure|food|great|great,"positive,positive"
87,1199480:2,i'd highly recommend it for a special occasion -- it provides and intimate setting and nice service.,"setting,service,NULL","AMBIENCE,SERVICE",SERVICE,service,"positive,positive,positive"
88,1205520:2,make sure you have the spicy scallop roll.. .,Spicy Scallop roll,FOOD,PRICES,sure|make,positive
89,1212346:1,"took my mom for mother's day, and the maitre d' was pretty rude.",maitre d',SERVICE,,,negative
90,1212346:4,tiny dessert was $8.00...just plain overpriced for what it is.,"dessert,dessert","FOOD,PRICES",FOOD,rice|dessert,"negative,negative"
91,1221938:0,the drinks are always welll made and wine selection is fairly priced.,"drinks,wine selection","FOOD,PRICES",PRICES,rice|always|well|wine|fairly,"positive,positive"
92,1221938:1,try their chef's specials-- they are to die for.,chef's specials,FOOD,,,positive
93,1221938:3,downstairs lounge is always a good attraction,Downstairs lounge,AMBIENCE,SERVICE,always|stair,positive
94,1225162:0,"raga's is a romantic, cozy restaurant.",Raga's,AMBIENCE,SERVICE,restaurant,positive
95,1225162:1,the exotic food is beautifully presented and is a delight in delicious combinations.,"exotic food,exotic food","FOOD,FOOD",FOOD,food|light|combination|full|delicious,"positive,positive"
96,1225162:3,the staff is incredibly helpful and attentive.,staff,SERVICE,SERVICE,staff,positive
97,1225162:4,the bar is very well stocked with interesting beers and well priced wines.,"bar,beers,wines","FOOD,FOOD,PRICES",PRICES,rice|well|well|wine,"positive,positive,positive"
98,1227999:1,"the waitress moved our table practically into the bathroom and when we asked to cancel our dinner orders because we did not want to eat sitting on the toilet, we were told no...",waitress,SERVICE,SERVICE,asked|table|room|dinner|order|sitting,negative
99,1230993:1,i loved everythig about it-especially the shows and actors.,"NULL,shows,actors","AMBIENCE,AMBIENCE",,every,"positive,positive,positive"
100,1230993:2,our server was very helpful and friendly.,server,SERVICE,AMBIENCE,friendly,positive
101,1230993:4,the food was good too.,food,FOOD,FOOD,food,positive
102,1232468:0,the tuna and wasabe potatoes are excellent.,"tuna,wasabe potatoes","FOOD,FOOD",,,"positive,positive"
103,1232468:1,the outdoor atmosphere of sitting on the sidewalk watching the world go by 50 feet away on 6th avenue on a cool evening was wonderful.,outdoor atmosphere,AMBIENCE,AMBIENCE,away|evening|atmosphere|sitting,positive
104,1232468:3,service was prompt and courteous.,Service,SERVICE,SERVICE,service,positive
105,1241906:0,"great service, great food.","service,food","SERVICE,FOOD",SERVICE,food|great|great|service,"positive,positive"
106,1253117:1,"the pizza is delicious - they use fresh mozzarella instead of the cheap, frozen, shredded cheese common to most pizzaria's.","pizza,fresh mozzarella","FOOD,FOOD",FOOD,delicious,"positive,positive"
107,1253117:2,"two complaints- their appetizer selection stinks, it would be nice to get some mozzarella sticks on the menu.",appetizer selection,FOOD,PRICES,would,negative
108,1253117:3,"also, because it is so thin, it gets cold very quickly and its not that filling.","NULL,NULL","FOOD,FOOD",PRICES,also,"negative,negative"
109,1256373:0,by far the best salad i have had in a fast food restaurant.,salad,FOOD,FOOD,food|restaurant|best,positive
110,1256373:1,fine dining restaurant quality.,dining,FOOD,SERVICE,restaurant,positive
111,1264954:1,"this was the perfect quiet, relaxing, and delicious accompaniment to our afternoon of theater.","NULL,NULL","FOOD,AMBIENCE",FOOD,quiet|relaxing|afternoon|delicious|theater,"positive,positive"
112,1264954:2,"the chicken pot pie is excpetiona, the cheeseburger huge and delictable, and the service professional wan warm.","chicken pot pie,cheeseburger,cheeseburger,service","FOOD,FOOD,FOOD,SERVICE",SERVICE,service|table,"positive,positive,positive,positive"
113,1269216:1,the staff is no nonsense.,staff,SERVICE,SERVICE,staff,positive
114,1269216:2,the food options rule.,food,FOOD,FOOD,food,positive
115,1269216:3,when i lived upstate for a while i would buy freeze the bagels and they would still be better than any else.,bagels,FOOD,PRICES,would|would|better|else,positive
116,1275154:4,"he served me an uni hand roll, which i never had before, and let me tell you...it was heaven!",Uni Hand roll,FOOD,SERVICE,served,positive
117,1275154:6,the sake menu should not be overlooked!,sake menu,FOOD,FOOD,sake,positive
118,1275154:8,try the lobster teriyaki and the rose special roll.,"lobster teriyaki,rose special roll","FOOD,FOOD",PRICES,rose,"positive,positive"
119,1280166:1,"service was very good - prompt, attentive and non-intrusive.",Service,SERVICE,SERVICE,service,positive
120,1280166:3,wine list selection is good and wine-by-the-glass was generously filled to the top.,"Wine list selection,wine-by-the-glass","FOOD,FOOD",FOOD,glass|wine|wine,"positive,positive"
121,1280179:2,"seating is always prompt, though the restaurant does fill up in the evening.",Seating,SERVICE,SERVICE,always|seating|evening|restaurant,positive
122,1280179:5,"the decor is vibrant and eye-pleasing with several semi-private boths on the right side of the dining hall, which are great for a date.","decor,semi-private boths","AMBIENCE,AMBIENCE",AMBIENCE,great|date,"positive,positive"
123,1286916:1,"the first time i went, and was completely taken by the live jazz band and atmosphere, i ordered the lobster cobb salad.","live jazz band,atmosphere","AMBIENCE,AMBIENCE",AMBIENCE,time|order|atmosphere,"positive,positive"
124,1286916:3,it's simply the best meal in nyc.,meal,FOOD,FOOD,best|meal,positive
125,1287538:3,the food is a diamond in rough -- the food is delicious and homemade with the perfect balance of herbs and tomatoes.,"food,balance of herbs and tomatoes","FOOD,FOOD",FOOD,food|food|delicious,"positive,positive"
126,1289424:3,the server was really cool and served us our food and drinks with a smile.,server,SERVICE,FOOD,food|served|really|smile|real,positive
127,1289424:4,the place's decor and hidden bathrooms made for a good laugh.,"decor,hidden bathrooms","AMBIENCE,AMBIENCE",AMBIENCE,place|room,"positive,positive"
128,1293334:2,"the have over 100 different beers to offer thier guest so that made my husband very happy and the food was delicious, if i must recommend a dish it must be the pumkin tortelini.","beers,food,pumkin tortelini","FOOD,FOOD,FOOD",FOOD,food|dish|delicious,"positive,positive,positive"
129,1297844:2,the bagel was huge.,bagel,FOOD,,,positive
130,1297844:4,the workers there also absolutely load the bagel with cream cheese (gets a little messy).,bagel,FOOD,PRICES,little|also,negative
131,1300636:0,this was my frist time at cafe st. bart's and i must say how delicous the food and the service was.,"food,service","FOOD,SERVICE",SERVICE,food|service|time,"positive,positive"
132,1300636:2,i have to highly recommend the lobster roll - not to much mayo; you can tell it was a fresh lobster.,"lobster roll,lobster","FOOD,FOOD",PRICES,much,"positive,positive"
133,1300636:3,"other guests enjoyed pizza, santa fe chopped salad and fish and chips.","pizza,santa fe chopped salad,fish and chips","FOOD,FOOD,FOOD",,,"positive,positive,positive"
134,1300636:4,"i highly recommend cafe st. bart's for their food, the ambience and wonderful service.","food,ambience,service","FOOD,AMBIENCE,SERVICE",SERVICE,food|ambience|service,"positive,positive,positive"
135,1303888:0,all the staff is absolutely professional!!,staff,SERVICE,SERVICE,staff,positive
136,1303984:1,my chow fun and chow see was really bland and oily.,chow fun and chow see,FOOD,PRICES,really|real,negative
137,1308557:1,"it's boring on the inside, and our sushi was pretty below average... the tuna was soggy and the other rolls had no flavor.","NULL,sushi,tuna,rolls","AMBIENCE,FOOD,FOOD,FOOD",FOOD,sushi,"negative,negative,negative,negative"
138,1310217:1,their pad penang is delicious and everything else is fantastic.,"pad penang,NULL","FOOD,FOOD",FOOD,every|delicious|else,"positive,positive"
139,1318537:0,fresh restaurant was amazing........ food was delicious and of course fresh.,"fresh restaurant,food",FOOD,FOOD,food|restaurant|delicious,"positive,positive"
140,1318537:1,"great for a romantic evening, or a fun evening with friends...","NULL,NULL",AMBIENCE,AMBIENCE,great|evening|evening,"positive,positive"
141,1318537:4,hats off to the chef.,chef,FOOD,,,positive
142,1328078:3,"the salads are delicious, both refreshing and very spicy.",salads,FOOD,FOOD,delicious,positive
143,1328078:4,we had pam's special fried fish and it was amazing.,Pam's special fried fish,FOOD,,,positive
144,1335154:1,"great vibe, lots of people.",vibe,AMBIENCE,AMBIENCE,great,positive
145,1335154:4,"i didn't complain, i liked the atmosphere so much.",atmosphere,AMBIENCE,AMBIENCE,much|atmosphere,positive
146,1335656:2,"ambience is so cute and quaint, good for business although we were there on vacation.","Ambience,NULL",AMBIENCE,AMBIENCE,ambience,"positive,positive"
147,1335656:3,salads were fantastic.,Salads,FOOD,,,positive
148,1335656:4,although we were looking for regular lettuce and some walnuts the salads we got were great.,salads,FOOD,AMBIENCE,great,positive
149,1335656:5,ingredients are organic which is a real plus for me.,Ingredients,FOOD,PRICES,real,positive
150,1338124:0,"this is some really good, inexpensive sushi.","sushi,sushi","FOOD,PRICES",FOOD,really|sushi|real|expensive,"positive,positive"
151,1338124:2,the spicy tuna roll is huge and probably the best that i've had at this price range.,"spicy Tuna roll,spicy Tuna roll,spicy Tuna roll","FOOD,FOOD,PRICES",PRICES,rice|best,"positive,positive,positive"
152,1338124:3,the yellowtail was particularly good as well.,Yellowtail,FOOD,AMBIENCE,well,positive
153,1338124:4,"i have reservations about the all you can eat deal, however -- the choices are fairly limited and you can probably order more food than you can eat for less than $18 by just going off the menu.","all you can eat deal,all you can eat deal","FOOD,PRICES",PRICES,food|order|fairly|reservation|limited,"negative,negative"
154,1340075:1,"they have it all -- great price, food, and service.","NULL,NULL,food,service","PRICES,FOOD,SERVICE",PRICES,food|great|rice|service,"positive,positive,positive,positive"
155,1340075:4,"and it all comes at a very reasonable price (congee, noodles, and rice dishes are no more than $3-6 each).","NULL,congee,noodles,rice dishes","PRICES,PRICES,PRICES,PRICES",PRICES,rice|rice|come|dish,"positive,positive,positive,positive"
156,1340075:5,the takeout is great too since they give high quality tupperware as well.,takeout,SERVICE,AMBIENCE,great|well,positive
157,1341354:1,enjoyed a very nice caesar salad while my wife had arugula and goat cheese....both very tasty.,"Caesar Salad,arugula and goat cheese","FOOD,FOOD",FOOD,tasty,"positive,positive"
158,1341354:2,we both opted for a pasta dish and they were served timely and fresh.,"NULL,pasta dish","SERVICE,FOOD",FOOD,served|dish|time,"positive,positive"
159,1341354:3,"we concluded with tiramisu chocolate cake, both were delicious.","tiramisu,chocolate cake","FOOD,FOOD",FOOD,delicious,"positive,positive"
160,1347423:1,"the staff was accomodating, the food was absolutely delicious and the place is lovely.","staff,food,place","SERVICE,FOOD,AMBIENCE",FOOD,place|food|staff|delicious,"positive,positive,positive"
161,1347423:2,we even had a visit from the manager who wanted to make sure we were enjoying ourselves.,Manager,SERVICE,PRICES,sure|make,positive
162,1349391:1,"sometimes i get bad food and bad service, sometimes i get good good and bad service.","food,service,service,good","FOOD,SERVICE,SERVICE,FOOD",SERVICE,food|service|service|time|time,"negative,negative,negative,positive"
163,1352948:0,the place is a bistro which means: simple dishes and wine served efficiently in a bustling atmosphere.,"dishes,wine,NULL,atmosphere","FOOD,FOOD,SERVICE,AMBIENCE",FOOD,place|bistro|served|dish|atmosphere|wine,"positive,positive,positive,positive"
164,1352948:2,"you are not eating haut cuisine with subtle hints of whatever but: cassuolet, steake fritte, tripe stew, etc; simple stuff.","NULL,NULL","FOOD,FOOD",PRICES,hate,"positive,positive"
