,id,review,target,label,predict,term,polarity
336,527109:0,"volare virgins or weekly regulars, everyone gets treated the same and you can't ask for more than that when the service is this friendly.",service,SERVICE,SERVICE,service|friendly|week|every,positive
337,527109:3,the wine list is extensive and can easily hike up an otherwise reasonably priced meal.,"wine list,meal","FOOD,PRICES",FOOD,rice|wise|wine|meal,"positive,positive"
338,535171:1,not the typical nyc gimmick theme restaurant.,restaurant,AMBIENCE,SERVICE,restaurant,positive
339,536919:1,the only thing the waiters don't do for you is wipe your chin when you leave.,waiters,SERVICE,,,positive
340,541532:0,cozy romantic atomosphere with only around 15 tables at most.,atomosphere,AMBIENCE,SERVICE,table,positive
341,558423:5,quick and friendly service.,service,SERVICE,SERVICE,service|friendly,positive
342,561054:1,"when you're sitting in their main dining room (which has a spectacular, hand-painted high ceiling) you'd never know there was a world outside.","main dining room,ceiling","AMBIENCE,AMBIENCE",SERVICE,room|sitting,"positive,positive"
343,561054:3,"i can't wait for summer, when they serve outside on their gigantic patio.",patio,AMBIENCE,,,positive
344,565344:1,this little place definitely exceeded my expectations and you sure get a lot of food for your money.,"food,place,food","FOOD,PRICES",PRICES,place|sure|money|food|little|exceeded|definitely|expectation|expect,"positive,positive,positive"
345,584025:1,warm and friendly in the winter and terrific outdoor seating in the warmer months.,"NULL,outdoor seating","AMBIENCE,AMBIENCE",AMBIENCE,seating|friendly,"positive,positive"
346,584025:2,the food is great and they have a good selecion of wines at reasonable prices.,"food,selecion of wines,selecion of wines","FOOD,FOOD,PRICES",PRICES,food|great|rice|wine,"positive,positive,positive"
347,610611:4,"service is friendly, and never had a problem walking in and getting a table.","service,NULL",SERVICE,SERVICE,service|problem|friendly|table,"positive,positive"
348,620892:5,"service, however, was excellent...and i liked the setting/atmosphere a lot.","Service,setting/atmosphere","SERVICE,AMBIENCE",SERVICE,service|atmosphere,"positive,positive"
349,624715:0,this place is a great bargain.,place,PRICES,PRICES,place|great|bargain,positive
350,624715:2,people are always friendly.,People,SERVICE,AMBIENCE,always|friendly,positive
351,624715:4,"just straight up cheap, good food.","food,food","FOOD,PRICES",FOOD,food,"positive,positive"
352,626269:2,the design and atmosphere is just as good.,"design,atmosphere","AMBIENCE,AMBIENCE",AMBIENCE,atmosphere,"positive,positive"
353,626269:3,bottles of wine are cheap and good.,"bottles of wine,bottles of wine","PRICES,FOOD",FOOD,wine,"positive,positive"
354,632121:1,the jukebox plays everything from italian opera to the strokes.,jukebox,AMBIENCE,FOOD,every,positive
355,632121:3,"best of all is the warm vibe, the owner is super friendly and service is fast.","vibe,owner,service","AMBIENCE,SERVICE,SERVICE",SERVICE,service|friendly|best,"positive,positive,positive"
356,657129:3,the drinks are amazing and half off till 8pm.,"drinks,drinks","FOOD,PRICES",,,"positive,positive"
357,657129:4,"ask for usha, the nicest bartender in manhattan.",Usha,SERVICE,SERVICE,tend,positive
358,680390:0,"toons has recently been redone, so it's now a very attractive space.",Toons,AMBIENCE,,,positive
359,682391:2,the service is good and the resturant is clean.,"service,resturant","SERVICE,AMBIENCE",SERVICE,service,"positive,positive"
360,707917:2,rao's has the best service and atmosphere in nyc.,"service,atmosphere","SERVICE,AMBIENCE",AMBIENCE,service|atmosphere|best,"positive,positive"
361,709294:1,"we recently decided to try this location, and to our delight, they have outdoor seating, perfect since i had my yorkie with me.",outdoor seating,AMBIENCE,AMBIENCE,location|light|seating,positive
362,709294:2,indoor was very cozy and cute.,Indoor,AMBIENCE,,,positive
363,709294:5,staff is very accomodating.,Staff,SERVICE,SERVICE,staff,positive
364,713152:4,i won't go back unless someone else is footing the bill.,"NULL,NULL",PRICES,SERVICE,back|else|someone,"negative,negative"
365,717570:1,the decor is very simple but comfortable.,decor,AMBIENCE,AMBIENCE,table,positive
366,717570:5,the staff there is very attentive and down to earth.,staff,SERVICE,SERVICE,staff,positive
367,720418:1,the owner truly caters to all your needs.,owner,SERVICE,PRICES,truly,positive
368,720418:4,great food and the prices are very reasonable.,"food,NULL","FOOD,PRICES",PRICES,food|great|rice,"positive,positive"
369,720620:5,simply some good tasting chinese food at incredible prices...,"Chinese food,Chinese food","FOOD,PRICES",PRICES,food|rice,"positive,positive"
370,720620:6,service is not what you are coming here for...,Service,SERVICE,SERVICE,service,negative
371,735448:1,"whoever the jazz duo was, they were on point.",jazz duo,AMBIENCE,,,positive
372,735448:2,"good music, great food, speedy service affordable prices.","music,food,service,NULL","AMBIENCE,FOOD,SERVICE,PRICES",PRICES,food|great|rice|service,"positive,positive,positive,positive"
373,737999:3,atmosphere is nice and relaxed too...,Atmosphere,AMBIENCE,AMBIENCE,atmosphere,positive
374,740923:2,price and quality of fish alone will keep us from making a return visit.,"fish,fish,NULL","PRICES,FOOD",PRICES,rice,"negative,negative,negative"
375,744478:1,"fabulous decor - makes you feel like you're in a trendy manhattan restaurant, very very good food, cheaply-priced, generally friendly staff, and if you're a manhattanite, or spend most of your time in manhattan, rice avenue will make you feel at home.....very soho/village/upper west side minus the expensive prices and pretentious clientele.....all on roosevelt avenue!","decor,food,food,staff,Rice Avenue,Rice Avenue,Rice Avenue","AMBIENCE,FOOD,PRICES,SERVICE,AMBIENCE,AMBIENCE,PRICES",FOOD,food|rice|rice|rice|staff|friendly|restaurant|time|make|make|spend|fabulous|expensive,"positive,positive,positive,positive,positive,positive,positive"
376,746254:4,"with so many good restaurants on the uws, i don't need overpriced food, absurdly arrogant wait-staff who don't recognize they work at a glorified diner, clumsy service, and management that doesn't care.","food,wait-staff,service,management","PRICES,SERVICE,SERVICE,SERVICE",FOOD,food|rice|service|staff|restaurant,"negative,negative,negative,negative"
377,751493:0,i am relatively new to the area and tried pick a bgel on 2nd and was disappointed with the service and i thought the food was overated and on the pricey side.,"service,food,food","SERVICE,PRICES,FOOD",PRICES,food|rice|service|area,"negative,negative,negative"
378,757762:0,baluchi's has solid food and a nice decor at reasonable prices.,"food,decor,Baluchi's","FOOD,AMBIENCE,PRICES",PRICES,food|rice,"positive,positive,positive"
379,758263:3,$20 for all you can eat sushi cannot be beaten.,all you can eat sushi,PRICES,FOOD,sushi,positive
380,875139:0,"love the scene first off- the place has a character and nice light to it..very fortunate, location wise.","scene,place,location","AMBIENCE,AMBIENCE,AMBIENCE",AMBIENCE,place|character|wise|location|light,"positive,positive,positive"
381,955711:2,love the atmosphere - felt like i was in paris.,atmosphere,AMBIENCE,AMBIENCE,atmosphere,positive
382,BFC#4:0,overpriced and not tasty,"NULL,NULL","PRICES,FOOD",FOOD,tasty|rice,"negative,negative"
383,BFC#4:2,it was totally overpriced- fish and chips was about $15....,"NULL,fish and chips","PRICES,PRICES",PRICES,rice,"negative,negative"
384,EVPK#10:1,i was visiting new york city with a friend and we discovered this really warm and inviting restaurant.,restaurant,AMBIENCE,SERVICE,really|restaurant|real,positive
385,Z#3:1,"the space kind of feels like an alice in wonderland setting, without it trying to be that.",space,AMBIENCE,SERVICE,trying,negative
386,Z#3:2,"i paid just about $60 for a good meal, though :)","meal,meal","FOOD,PRICES",FOOD,meal,"positive,positive"
387,TR#3:0,great place to relax and enjoy your dinner,place,AMBIENCE,AMBIENCE,place|great|dinner,positive
388,TR#3:1,there is something about their atmosphere that makes me come back nearly every week.,atmosphere,AMBIENCE,PRICES,back|come|nearly|week|every|something|make|atmosphere,positive
389,TM#7:0,excellent food for great prices,"food,food","FOOD,PRICES",PRICES,food|great|rice,"positive,positive"
390,RL#3:1,"im not necessarily fanatical about this place, but it was a fun time for low pirces.","place,place",PRICES,AMBIENCE,place|time,"positive,positive"
391,PP#4:4,i thought the restaurant was nice and clean.,"restaurant,restaurant",AMBIENCE,SERVICE,restaurant,"positive,positive"
392,TFS#8:0,"not because you are ""the four seasons""...  you are allowed to charge an arm and a leg for a romatic dinner.",The Four Seasons,PRICES,FOOD,dinner,negative
393,TFS#8:2,i do not think dinner in manhattan should cost $400.00 where i am not swept off my feet.,dinner,PRICES,FOOD,dinner,negative
394,Y#6:3,"in the summer months, the back garden area is really nice.",back garden area,AMBIENCE,AMBIENCE,back|really|garden|area|real,positive
395,P#10:3,and $11 for a plate of bland guacamole?,"guacamole,guacamole","FOOD,PRICES",FOOD,plate,"negative,negative"
396,TM#3:3,"the food was good, the place was clean and affordable.","food,place,place","FOOD,AMBIENCE,PRICES",FOOD,place|food,"positive,positive,positive"
397,TR#1:3,i highly recommend this beautiful place.,"place,place",AMBIENCE,AMBIENCE,place,"positive,positive"
398,TR#8:4,we were offered water for the table but were not told the voss bottles of water were $8 a piece.,Voss bottles of water,PRICES,SERVICE,table,negative
399,TR#8:6,nice view of river and nyc.,view of river and NYC,AMBIENCE,,,positive
400,CLF#1:0,a beautifully designed dreamy egyptian restaurant that gets sceney at night.,Egyptian restaurant,AMBIENCE,AMBIENCE,restaurant|full|night,positive
401,CLF#1:2,"oh, and there's hookah.",hookah,AMBIENCE,,,positive
402,Z#11:4,most of the booths allow you to sit next to eachother without looking like 'that' couple.,booths,AMBIENCE,,,positive
403,TR#2:6,$170 down the toilet...,"NULL,NULL",PRICES,,,"negative,negative"
404,TR#2:7,"oh speaking of bathroom , the mens bathroom was disgusting.",mens bathroom,AMBIENCE,FOOD,room|room,negative
405,Z#9:0,"short and sweet  seating is great:it's romantic,cozy and private.",seating,AMBIENCE,AMBIENCE,great|seating,positive
406,Z#9:1,the boths are not as small as some of the reviews make them out to look they're perfect for 2 people.,boths,AMBIENCE,PRICES,small|make,positive
407,NP#3:6,prices are fair across the board for both food and bev.,"food,bev","PRICES,PRICES",PRICES,food|rice,"positive,positive"
408,CLF#5:5,we were drawn into the belly dancing show that captivated the crowd.,belly dancing show,AMBIENCE,,,positive
409,BzG#2:0,"great place, great value.","place,place",PRICES,AMBIENCE,place|great|great,"positive,positive"
410,BzG#2:1,"the food is flavorful, plentiful and reasonably priced.","food,food,food","FOOD,FOOD,PRICES",PRICES,food|rice,"positive,positive,positive"
411,BzG#2:2,the atmosphere is relaxed and casual.,atmosphere,AMBIENCE,AMBIENCE,atmosphere,positive
412,TVU#4:1,"inexpensive, unassuming, great time!","NULL,NULL",PRICES,PRICES,great|time|expensive,"positive,positive"
413,Z#5:1,mazing interior.,interior,AMBIENCE,,,negative
414,Z#5:4,"the atmosphere was pretty nice but had a bit lacking, which it tries to make up for with a crazy scheme of mirrors.","atmosphere,scheme of mirrors","AMBIENCE,AMBIENCE",AMBIENCE,make|atmosphere,"negative,negative"
415,TM#5:3,helpful service and average price per dish $10.,"service,dish","SERVICE,PRICES",PRICES,rice|service|dish,"positive,positive"
416,TM#5:4,the only thing that strikes you is the decor?(not very pleasant).,decor,AMBIENCE,AMBIENCE,pleasant,negative
417,TM#6:2,the flavors are amazing and the value is phenomenal.,"NULL,NULL","FOOD,PRICES",,,"positive,positive"
418,TVU#6:3,the martinis are amazing and very fairly priced.,"martinis,martinis","FOOD,PRICES",PRICES,rice|fairly,"positive,positive"
419,TVU#6:5,"the dj is awesome, i have been there for my birthday and a bunch of other times with friends and i keep going back.","DJ,NULL",AMBIENCE,SERVICE,back|time,"positive,positive"
420,TVU#6:8,in the end you end up with a fair tab and nothing but a great time!!!,"NULL,NULL",PRICES,AMBIENCE,great|time,"positive,positive"
421,TFS#5:2,but $500 for a dinner for two that didn't include wine?,dinner for two,PRICES,FOOD,dinner|wine,negative
422,TFS#5:21,"i read reviews that called the restaurant too expensive and i thought to myself, but may be it is worth it.","restaurant,restaurant",PRICES,PRICES,restaurant|expensive,"negative,negative"
423,TFS#5:24,"i wanted to go there to see if it was worth it and sadly, curiousity got the best of me and i paid dearly for it.","NULL,NULL",PRICES,PRICES,best,"negative,negative"
424,TFS#5:30,"service was just ok, it is not what you'd expect for $500.","Service,NULL","SERVICE,PRICES",PRICES,service|expect,"negative,negative"
425,CLF#3:0,terrible waste of money.. scammers,"NULL,NULL",PRICES,PRICES,money,"negative,negative"
426,CLF#3:3,i am actually offended to have spent so much money on such a bad experience.,"NULL,NULL",PRICES,PRICES,money|much|actually,"negative,negative"
427,CLF#3:4,i literally just got back home after visiting casa la femme and was so offended by my visit felt it necessary to try and warn other diners who value their money and time.,"Casa La Femme,Casa La Femme",PRICES,PRICES,money|back|warn|time,"negative,negative"
428,CLF#3:6,"our visit their to say the least, was an unpleasant and costly experience!","NULL,NULL",PRICES,FOOD,pleasant,"negative,negative"
429,CLF#3:7,and even more so unpleasant because it was so costly for such an unpleasant experience.,"NULL,NULL",PRICES,FOOD,pleasant|pleasant,"negative,negative"
430,CLF#3:11,the place is beautiful!,place,AMBIENCE,AMBIENCE,place,positive
431,CLF#3:13,"however, our $14 drinks were were horrible!","drinks,drinks","FOOD,PRICES",,,"negative,negative"
432,CLF#3:23,i would not expect this for a $55 dinner.,"dinner,dinner","FOOD,PRICES",PRICES,would|dinner|expect,"negative,negative"
433,CLF#3:28,"by the time we left our wallets were empy and so were our stomachs and we missed the show we were supposed to see following our dinner, which would have been acceptable if we got to enjoy the experience of good food and belly dancers!","food,NULL,NULL","FOOD,PRICES",FOOD,food|would|table|wall|time|dinner|left,"negative,negative,negative"
434,CLF#3:29,if it seemed possible to do so while there i would have fought my bill since my dinner portion of my meal was inedible!,"meal,NULL","FOOD,PRICES",FOOD,would|dinner|meal,"negative,negative"
435,CLF#3:30,"i have never left a restaurant feeling as if i was abused, and wasted my hard earned money.","restaurant,restaurant",PRICES,SERVICE,money|restaurant|left,"negative,negative"
436,CLF#3:31,my husbands birthday and my sons was not as it was intended... and we drove two hours to spend too much money to be treated terribly!,"NULL,NULL,NULL","PRICES,SERVICE",PRICES,money|much|tend|spend,"negative,negative,negative"
437,BG#5:4,"i have it a 4 instead of 5 because of the price (just chicken tikka masala - no bread of rice - is $25), which i would expect at a upscale indian restaurant but this place doesn't have an upscale feel.","place,place,chicken tikka masala,feel","PRICES,PRICES,AMBIENCE",PRICES,place|rice|rice|would|restaurant|expect,"positive,negative,negative,negative"
438,BG#5:6,i don't appreciate places or people that try to drive up the bill without the patron's knowledge so that was a huge turnoff (more than the price).,"NULL,NULL","SERVICE,PRICES",PRICES,place|rice|patron,"negative,negative"
439,CLF#7:0,gorgeous place ideal for a romantic dinner,"place,place",AMBIENCE,FOOD,place|dinner,"positive,positive"
440,DBG#7:5,too bad i had paid an extra $2 for the stone bowl.,stone bowl,PRICES,,,negative
441,Z#6:0,possibly the most romantic restaurant in the city,Restaurant,AMBIENCE,SERVICE,restaurant,positive
442,Z#6:1,"this is undoubtedly my favorite modern japanese brasserie (that dont serve sushi), and in my opinion, one of the most romantic restaurants in the city!","modern Japanese brasserie,modern Japanese brasserie",AMBIENCE,FOOD,restaurant|sushi,"positive,positive"
443,Z#6:3,"if youre planning to come here, make sure that your date is someone whom you really like since youll be ushered to private booths where there will be no people or food watching (choose the ones on the ground level that have glass ceilings so you may see the stars in the sky!).","private booths,glass ceilings","AMBIENCE,AMBIENCE",PRICES,sure|food|come|date|planning|really|ground|glass|make|real|someone,"positive,positive"
444,Z#6:5,"my party had the bbe $29 fixe prix menu, which was such a wonderful deal since it also came with a flight of sake!","BBE $29 fixe prix menu,BBE $29 fixe prix menu","PRICES,FOOD",SERVICE,also|fixe|flight|sake|prix|light,"positive,positive"
445,Z#6:13,"maybe it was the great company (i had friends visiting from philly  yes, it was not a date this time) or the super reasonable price point, but i just cant say enough good things about this brasserie.","brasserie,brasserie",PRICES,PRICES,great|rice|date|time|maybe,"positive,positive"
446,Z#6:14,"i dont usually visit the same establishment more than once, what more twice, but ill come to zenkichi anytime for a quiet, unhurried and memorable dinner.","Zenkichi,Zenkichi",AMBIENCE,SERVICE,come|time|anytime|quiet|twice|dinner|zenkichi,"positive,positive"
447,CLF#6:5,"they are extremely rude, not even apologizing for the horrible service we got and handing us a bill well over $500 for some drinks adn their pita bread!","service,drinks,pita bread,NULL","SERVICE,PRICES,PRICES,SERVICE",SERVICE,service|well,"negative,negative,negative,negative"
448,DBG#6:7,"the meat is fresh, the sauces are great, you get kimchi and a salad free with your meal and service is good too.","meat,sauces,service,meal,kimchi,salad","FOOD,FOOD,SERVICE,FOOD,PRICES,PRICES",SERVICE,great|service|meal,"positive,positive,positive,positive,positive,positive"
449,TR#5:6,"price is high but the food is good, so i would come back again.","food,food,NULL","FOOD,PRICES",PRICES,food|rice|back|would|come,"positive,negative,positive"
450,Z#7:2,"this place has totally weird decor, stairs going up with mirrored walls - i am surprised how no one yet broke their head or fall off the stairs - mirrored walls make you dizzy and delusional...","decor,mirrored walls","AMBIENCE,AMBIENCE",AMBIENCE,place|mirrored|mirrored|stair|stair|wall|wall|broke|head|make,"negative,negative"
451,FF#4:10,"at $120 for two people, however, this in no way represents value, unless you're looking to pay by the hour for passive-aggressive torture.","NULL,NULL,NULL","PRICES,SERVICE",,,"negative,negative,negative"
452,FF#3:9,"i took one bite from the $24 salmon, and i have never, in the 17 years i have been going to restaurants tasted salmon as fishy, as dry, and as bland as the one in flatbush farms.","salmon,salmon","FOOD,PRICES",FOOD,restaurant,"negative,negative"
453,BHD#4:5,only complaint is the pricing--i believe it would be more reasonable to pay a dollar less on each item listed on the menu.,menu,PRICES,PRICES,would,negative
454,BFC#7:11,"considering you will spend at least $60 a head, i expect better service.","service,NULL","SERVICE,PRICES",PRICES,better|service|head|expect|spend,"negative,negative"
455,CLF#8:9,cant believe how an expensive nyc restaurant can be so disrespectful to its clients.,"restaurant,NULL","PRICES,SERVICE",PRICES,restaurant|expensive,"negative,negative"
456,WE#1:3,"the bread was stale, the salad was overpriced and empty.","bread,salad,salad","FOOD,PRICES,FOOD",PRICES,rice,"negative,negative,negative"
