,id,review,opinion,label,preprocessed
144,426930:0,authentic taiwanese food that's cheap... what more could you ask for?,authentic,positive,"['authentic', 'taiwanese', 'food', 'thats', 'cheap', 'could', 'ask']"
145,475298:2,food is great and inexpensive.,great,positive,"['food', 'great', 'inexpensive']"
146,512294:0,"great food, great prices, great service.",great,positive,"['great', 'food', 'great', 'price', 'great', 'service']"
147,512294:1,"if you are looking for a good quality, cheap eats - this is the place.",good,positive,"['looking', 'good', 'quality', 'cheap', 'eats', 'place']"
148,527109:3,the wine list is extensive and can easily hike up an otherwise reasonably priced meal.,reasonably,positive,"['wine', 'list', 'extensive', 'easily', 'hike', 'otherwise', 'reasonably', 'priced', 'meal']"
149,565344:1,this little place definitely exceeded my expectations and you sure get a lot of food for your money.,exceeded,positive,"['little', 'place', 'definitely', 'exceeded', 'expectation', 'sure', 'get', 'lot', 'food', 'money']"
150,584025:2,the food is great and they have a good selecion of wines at reasonable prices.,good,positive,"['food', 'great', 'good', 'selecion', 'wine', 'reasonable', 'price']"
151,620892:3,ravioli was good...but i have to say that i found everything a bit overpriced.,overpriced,positive,"['ravioli', 'goodbut', 'say', 'found', 'everything', 'bit', 'overpriced']"
152,624715:4,"just straight up cheap, good food.",good,positive,"['straight', 'cheap', 'good', 'food']"
153,626269:3,bottles of wine are cheap and good.,cheap,positive,"['bottle', 'wine', 'cheap', 'good']"
154,657129:3,the drinks are amazing and half off till 8pm.,amazing,positive,"['drink', 'amazing', 'half', 'till', 'pm']"
155,720418:4,great food and the prices are very reasonable.,great,positive,"['great', 'food', 'price', 'reasonable']"
156,720620:5,simply some good tasting chinese food at incredible prices...,good,positive,"['simply', 'good', 'tasting', 'chinese', 'food', 'incredible', 'price']"
157,735448:2,"good music, great food, speedy service affordable prices.",great,positive,"['good', 'music', 'great', 'food', 'speedy', 'service', 'affordable', 'price']"
158,744478:1,"fabulous decor - makes you feel like you're in a trendy manhattan restaurant, very very good food, cheaply-priced, generally friendly staff, and if you're a manhattanite, or spend most of your time in manhattan, rice avenue will make you feel at home.....very soho/village/upper west side minus the expensive prices and pretentious clientele.....all on roosevelt avenue!",friendly,positive,"['fabulous', 'decor', 'make', 'feel', 'like', 'trendy', 'manhattan', 'restaurant', 'good', 'food', 'cheaplypriced', 'generally', 'friendly', 'staff', 'manhattanite', 'spend', 'time', 'manhattan', 'rice', 'avenue', 'make', 'feel', 'homevery', 'sohovillageupper', 'west', 'side', 'minus', 'expensive', 'price', 'pretentious', 'clienteleall', 'roosevelt', 'avenue']"
159,751493:0,i am relatively new to the area and tried pick a bgel on 2nd and was disappointed with the service and i thought the food was overated and on the pricey side.,pricey,negative,"['relatively', 'new', 'area', 'tried', 'pick', 'bgel', 'nd', 'disappointed', 'service', 'thought', 'food', 'overated', 'pricey', 'side']"
160,757762:0,baluchi's has solid food and a nice decor at reasonable prices.,solid,positive,"['baluchi', 'solid', 'food', 'nice', 'decor', 'reasonable', 'price']"
161,Z#3:2,"i paid just about $60 for a good meal, though :)",good,positive,"['paid', '', 'good', 'meal', 'though']"
162,TM#7:0,excellent food for great prices,excellent,positive,"['excellent', 'food', 'great', 'price']"
163,P#10:3,and $11 for a plate of bland guacamole?,bland,negative,"['', 'plate', 'bland', 'guacamole']"
164,TM#3:3,"the food was good, the place was clean and affordable.",good,positive,"['food', 'good', 'place', 'clean', 'affordable']"
165,BzG#2:1,"the food is flavorful, plentiful and reasonably priced.",plentiful,positive,"['food', 'flavorful', 'plentiful', 'reasonably', 'priced']"
166,CLF#3:13,"however, our $14 drinks were were horrible!",horrible,negative,"['however', '', 'drink', 'horrible']"
167,CLF#3:23,i would not expect this for a $55 dinner.,expect,negative,"['would', 'expect', '', 'dinner']"
168,CLF#3:28,"by the time we left our wallets were empy and so were our stomachs and we missed the show we were supposed to see following our dinner, which would have been acceptable if we got to enjoy the experience of good food and belly dancers!",good,negative,"['time', 'left', 'wallet', 'empy', 'stomach', 'missed', 'show', 'supposed', 'see', 'following', 'dinner', 'would', 'acceptable', 'got', 'enjoy', 'experience', 'good', 'food', 'belly', 'dancer']"
169,CLF#3:29,if it seemed possible to do so while there i would have fought my bill since my dinner portion of my meal was inedible!,inedible,negative,"['seemed', 'possible', 'would', 'fought', 'bill', 'since', 'dinner', 'portion', 'meal', 'inedible']"
170,BFC#9:21,"all in all the food was good - a little on the expensive side, but fresh.",good,positive,"['food', 'good', 'little', 'expensive', 'side', 'fresh']"
171,BG#5:7,"but if you're prepared to spend some $ and remember to ask if something they offer is complimentary, then this is the place to go for indian food",complimentary,positive,"['prepared', 'spend', 'remember', 'ask', 'something', 'offer', 'complimentary', 'place', 'go', 'indian', 'food']"
172,BG#8:3,the lunch buffet is expensive but is deff worth it.,expensive,positive,"['lunch', 'buffet', 'expensive', 'deff', 'worth']"
173,Z#6:5,"my party had the bbe $29 fixe prix menu, which was such a wonderful deal since it also came with a flight of sake!",wonderful,positive,"['party', 'bbe', '', 'fixe', 'prix', 'menu', 'wonderful', 'deal', 'since', 'also', 'came', 'flight', 'sake']"
174,DBG#6:7,"the meat is fresh, the sauces are great, you get kimchi and a salad free with your meal and service is good too.",free,positive,"['meat', 'fresh', 'sauce', 'great', 'get', 'kimchi', 'salad', 'free', 'meal', 'service', 'good']"
175,TR#5:6,"price is high but the food is good, so i would come back again.",good,positive,"['price', 'high', 'food', 'good', 'would', 'come', 'back']"
176,FF#3:9,"i took one bite from the $24 salmon, and i have never, in the 17 years i have been going to restaurants tasted salmon as fishy, as dry, and as bland as the one in flatbush farms.",bland,negative,"['took', 'one', 'bite', '', 'salmon', 'never', '', 'year', 'going', 'restaurant', 'tasted', 'salmon', 'fishy', 'dry', 'bland', 'one', 'flatbush', 'farm']"
177,WE#1:3,"the bread was stale, the salad was overpriced and empty.",overpriced,negative,"['bread', 'stale', 'salad', 'overpriced', 'empty']"
