,id,review,opinion,label,preprocessed
0,1004293:1,"we, there were four of us, arrived at noon - the place was empty - and the staff acted like we were imposing on them and they were very rude.",empty|empty,negative,"['four', 'u', 'arrived', 'noon', 'place', 'empty', 'staff', 'acted', 'like', 'imposing', 'rude']"
1,1028246:1,"service was devine, oysters where a sensual as they come, and the price can't be beat!!!",sensual,positive,"['service', 'devine', 'oyster', 'sensual', 'come', 'price', 'cant', 'beat']"
2,1032695:1,"everything is always cooked to perfection, the service is excellent, the decor cool and understated.",excellent,positive,"['everything', 'always', 'cooked', 'perfection', 'service', 'excellent', 'decor', 'cool', 'understated']"
3,1053543:2,"their sake list was extensive, but we were looking for purple haze, which wasn't listed but made for us upon request!",extensive|purple,positive,"['sake', 'list', 'extensive', 'looking', 'purple', 'haze', 'listed', 'made', 'u', 'upon', 'request']"
4,1053543:4,we went around 9:30 on a friday and it had died down a bit by then so the service was great!,great,positive,"['went', 'around', '', 'friday', 'died', 'bit', 'service', 'great']"
5,1055910:3,service- friendly and attentive.,friendly|friendly,positive,"['service', 'friendly', 'attentive']"
6,1058221:3,"however, it's the service that leaves a bad taste in my mouth.",bad,negative,"['however', 'service', 'leaf', 'bad', 'taste', 'mouth']"
7,1058221:4,"i happen to have a policy that goes along with a little bit of self-respect, which includes not letting a waiter intimidate me, i.e. make me feel bad asking for trivialities like water, or the check.",bad,negative,"['happen', 'policy', 'go', 'along', 'little', 'bit', 'selfrespect', 'includes', 'letting', 'waiter', 'intimidate', 'ie', 'make', 'feel', 'bad', 'asking', 'triviality', 'like', 'water', 'check']"
8,1062641:3,service is top notch.,top,positive,"['service', 'top', 'notch']"
9,1074868:4,the food was well prepared and the service impecable.,prepared,positive,"['food', 'well', 'prepared', 'service', 'impecable']"
10,1086478:0,"the food here is rather good, but only if you like to wait for it.",good,negative,"['food', 'rather', 'good', 'like', 'wait']"
11,1086478:2,"the service varys from day to day- sometimes they're very nice, and sometimes not.",nice,negative,"['service', 'varys', 'day', 'day', 'sometimes', 'theyre', 'nice', 'sometimes']"
12,1090587:2,add to that great service and great food at a reasonable price and you have yourself the beginning of a great evening.,great,positive,"['add', 'great', 'service', 'great', 'food', 'reasonable', 'price', 'beginning', 'great', 'evening']"
13,1125284:2,"the signs, the specials menus, food, and even all the waitstaff are all totally japanese.",japanese|japanese,positive,"['sign', 'special', 'menu', 'food', 'even', 'waitstaff', 'totally', 'japanese']"
14,1126814:1,"my wife and i always enjoy the young, not always well trained but nevertheless friendly, staff, all of whom have a story.",friendly|friendly,positive,"['wife', 'always', 'enjoy', 'young', 'always', 'well', 'trained', 'nevertheless', 'friendly', 'staff', 'story']"
15,1126886:2,"the service is excellent, the decor is great, and the food is delicious and comes in large portions.",excellent,positive,"['service', 'excellent', 'decor', 'great', 'food', 'delicious', 'come', 'large', 'portion']"
16,1138996:1,"we have been to this place many times, and always have great food, wine, and service.",great,positive,"['place', 'many', 'time', 'always', 'great', 'food', 'wine', 'service']"
17,1138996:2,"we were worried we would have trouble getting in, but somehow managed to have a short wait.",short,positive,"['worried', 'would', 'trouble', 'getting', 'somehow', 'managed', 'short', 'wait']"
18,1138996:4,"when we sat, we got great and fast service.",fast,positive,"['sat', 'got', 'great', 'fast', 'service']"
19,1138996:5,the people that work there are always so friendly you forget you are in new york sometimes.,friendly,positive,"['people', 'work', 'always', 'friendly', 'forget', 'new', 'york', 'sometimes']"
20,1147211:2,the waitress was very patient with us and the food is phenomenal!,patient,positive,"['waitress', 'patient', 'u', 'food', 'phenomenal']"
21,1147211:3,"service was prompt, friendly and great.",prompt|friendly,positive,"['service', 'prompt', 'friendly', 'great']"
22,1153034:0,great pizza and fantastic service.,fantastic,positive,"['great', 'pizza', 'fantastic', 'service']"
23,1153034:1,"there was a small wait, but shorter than i expected.",small,positive,"['small', 'wait', 'shorter', 'expected']"
24,1189674:1,"the food was amazing, and the service was prompt and helpful, but not over-bearing or rushed.",prompt,positive,"['food', 'amazing', 'service', 'prompt', 'helpful', 'overbearing', 'rushed']"
25,1199480:2,i'd highly recommend it for a special occasion -- it provides and intimate setting and nice service.,nice,positive,"['id', 'highly', 'recommend', 'special', 'occasion', 'provides', 'intimate', 'setting', 'nice', 'service']"
26,1225162:3,the staff is incredibly helpful and attentive.,helpful,positive,"['staff', 'incredibly', 'helpful', 'attentive']"
27,1227999:1,"the waitress moved our table practically into the bathroom and when we asked to cancel our dinner orders because we did not want to eat sitting on the toilet, we were told no...",,negative,"['waitress', 'moved', 'table', 'practically', 'bathroom', 'asked', 'cancel', 'dinner', 'order', 'want', 'eat', 'sitting', 'toilet', 'told']"
28,1232468:3,service was prompt and courteous.,prompt,positive,"['service', 'prompt', 'courteous']"
29,1241906:0,"great service, great food.",great,positive,"['great', 'service', 'great', 'food']"
30,1253117:5,wait staff is blantently unappreciative of your business but its the best pie on the uws!,unappreciative|unappreciative,negative,"['wait', 'staff', 'blantently', 'unappreciative', 'business', 'best', 'pie', 'uws']"
31,1264954:2,"the chicken pot pie is excpetiona, the cheeseburger huge and delictable, and the service professional wan warm.",professional,positive,"['chicken', 'pot', 'pie', 'excpetiona', 'cheeseburger', 'huge', 'delictable', 'service', 'professional', 'wan', 'warm']"
32,1269216:1,the staff is no nonsense.,,positive,"['staff', 'nonsense']"
33,1280166:1,"service was very good - prompt, attentive and non-intrusive.",good,positive,"['service', 'good', 'prompt', 'attentive', 'nonintrusive']"
34,1300636:0,this was my frist time at cafe st. bart's and i must say how delicous the food and the service was.,delicous,positive,"['frist', 'time', 'cafe', 'st', 'bart', 'must', 'say', 'delicous', 'food', 'service']"
35,1300636:4,"i highly recommend cafe st. bart's for their food, the ambience and wonderful service.",wonderful,positive,"['highly', 'recommend', 'cafe', 'st', 'bart', 'food', 'ambience', 'wonderful', 'service']"
36,1303888:0,all the staff is absolutely professional!!,professional,positive,"['staff', 'absolutely', 'professional']"
37,1308557:0,the service was the only thing good about this restaurant.,only,positive,"['service', 'thing', 'good', 'restaurant']"
38,1310217:2,the price is reasonable although the service is poor.,poor,negative,"['price', 'reasonable', 'although', 'service', 'poor']"
39,1340075:1,"they have it all -- great price, food, and service.",great,positive,"['great', 'price', 'food', 'service']"
40,1340075:2,the atmosphere is noisy and the waiters are literally walking around doing things as fast as they can.,noisy,positive,"['atmosphere', 'noisy', 'waiter', 'literally', 'walking', 'around', 'thing', 'fast']"
41,1347423:1,"the staff was accomodating, the food was absolutely delicious and the place is lovely.",delicious,positive,"['staff', 'accomodating', 'food', 'absolutely', 'delicious', 'place', 'lovely']"
42,1349391:1,"sometimes i get bad food and bad service, sometimes i get good good and bad service.",bad|bad|bad|bad,negative,"['sometimes', 'get', 'bad', 'food', 'bad', 'service', 'sometimes', 'get', 'good', 'good', 'bad', 'service']"
43,1367358:3,"ambience is delightful, service impeccable.",impeccable,positive,"['ambience', 'delightful', 'service', 'impeccable']"
44,1380450:2,service was also horrible and the ambience is not that great.,horrible,negative,"['service', 'also', 'horrible', 'ambience', 'great']"
45,1387314:1,this is my first time writing a review for a restaurant because the food and service was excellent.,excellent,positive,"['first', 'time', 'writing', 'review', 'restaurant', 'food', 'service', 'excellent']"
46,1395421:1,the pizza and wine were excellent-the service too--but what really made this place was the backyard dining area.,excellent,positive,"['pizza', 'wine', 'excellentthe', 'service', 'toobut', 'really', 'made', 'place', 'backyard', 'dining', 'area']"
47,1398844:4,service is not what one would expect from a joint in this price category.,,negative,"['service', 'one', 'would', 'expect', 'joint', 'price', 'category']"
48,1398844:6,somehow working the italian charm with constant mille grazie does not constitute proper service.,proper,negative,"['somehow', 'working', 'italian', 'charm', 'constant', 'mille', 'grazie', 'constitute', 'proper', 'service']"
49,1404042:3,"cute place, nice wait staff but would never go there again.",nice|nice|nice|nice,positive,"['cute', 'place', 'nice', 'wait', 'staff', 'would', 'never', 'go']"
50,1410878:1,i've never had bad service and the fish is fresh and delicious.,bad,positive,"['ive', 'never', 'bad', 'service', 'fish', 'fresh', 'delicious']"
51,1413697:2,the place is so cool and the service is prompt and curtious.,prompt,positive,"['place', 'cool', 'service', 'prompt', 'curtious']"
52,1417496:0,a restaurant that doesn't try to do anything except serve great food with great service in a pleasant atmosphere.,great,positive,"['restaurant', 'try', 'anything', 'except', 'serve', 'great', 'food', 'great', 'service', 'pleasant', 'atmosphere']"
53,1417496:3,"the service was impeccable and unobtrusive -- the staff knows what they are there to do -- to know their menu, present your meal, and attend to your needs.",impeccable|present|unobtrusive,positive,"['service', 'impeccable', 'unobtrusive', 'staff', 'know', 'know', 'menu', 'present', 'meal', 'attend', 'need']"
54,1430994:0,the view is breathtaking the service is top notch... the ambiance is wonderfull.,top,positive,"['view', 'breathtaking', 'service', 'top', 'notch', 'ambiance', 'wonderfull']"
55,1430994:1,the staff offers impeccable service.,impeccable|impeccable,positive,"['staff', 'offer', 'impeccable', 'service']"
56,1439875:1,"the place is small and intimate and you may feel a little crowded, but the service is excellent and it's great for friends out, a romantic date, or a special occassion.",excellent,positive,"['place', 'small', 'intimate', 'may', 'feel', 'little', 'crowded', 'service', 'excellent', 'great', 'friend', 'romantic', 'date', 'special', 'occassion']"
57,1451107:6,the staff was the friendliest that have seen in new york.,friendliest,positive,"['staff', 'friendliest', 'seen', 'new', 'york']"
58,1459569:1,service was slow had to wait to order and get food although not crowded.,slow|slow,negative,"['service', 'slow', 'wait', 'order', 'get', 'food', 'although', 'crowded']"
59,1460715:1,service was quick.,quick,positive,"['service', 'quick']"
60,1476493:2,"the ambience was nice, but service wasn't so great.",nice,negative,"['ambience', 'nice', 'service', 'great']"
61,1490757:2,the prices were cheap compared to the quality of service and food.,cheap,positive,"['price', 'cheap', 'compared', 'quality', 'service', 'food']"
62,1538149:0,"i found the food, service and value exceptional everytime i have been there.",exceptional,positive,"['found', 'food', 'service', 'value', 'exceptional', 'everytime']"
63,1538149:3,the service was excellent - friendly and attentive.,excellent|friendly,positive,"['service', 'excellent', 'friendly', 'attentive']"
64,1543345:3,great staff.,great,positive,"['great', 'staff']"
65,1561259:1,but the staff was so horrible to us.,horrible,negative,"['staff', 'horrible', 'u']"
66,1561259:2,the hostess and the waitress were incredibly rude and did everything they could to rush us out.,rude|rude,negative,"['hostess', 'waitress', 'incredibly', 'rude', 'everything', 'could', 'rush', 'u']"
67,1561259:3,we were planning to get dessert but the waitress basically through the bill at us before we had a chance to order.,,negative,"['planning', 'get', 'dessert', 'waitress', 'basically', 'bill', 'u', 'chance', 'order']"
68,1561259:4,"this place is pricey, and yes, the food is worth it; but the service makes you feel like you should be paying a quater of the price.",worth,negative,"['place', 'pricey', 'yes', 'food', 'worth', 'service', 'make', 'feel', 'like', 'paying', 'quater', 'price']"
69,1572033:1,decor is nice though service can be spotty.,nice,negative,"['decor', 'nice', 'though', 'service', 'spotty']"
70,1586174:6,the waitstaffs are nice though.,nice|nice,positive,"['waitstaffs', 'nice', 'though']"
71,1603698:2,"both times i was extremely dissappointed by the service, which was boarderline rude.",boarderline,negative,"['time', 'extremely', 'dissappointed', 'service', 'boarderline', 'rude']"
72,1606837:2,the service was attentive.,attentive,positive,"['service', 'attentive']"
73,1623276:0,patroon features a nice cigar bar and has great staff.,great|great,positive,"['patroon', 'feature', 'nice', 'cigar', 'bar', 'great', 'staff']"
74,1626564:3,waitstaff are very friendly.,friendly|friendly,positive,"['waitstaff', 'friendly']"
75,1632445:3,the service is good and ambience is good for a date or group outing.,good,positive,"['service', 'good', 'ambience', 'good', 'date', 'group', 'outing']"
76,1632929:4,"when my dessert came, there was a candle in it - not because anyone asked for one - but because the waiter must have seen me opening my birthday card and gift, and said he knew it was a special occassion of some sort.",special,positive,"['dessert', 'came', 'candle', 'anyone', 'asked', 'one', 'waiter', 'must', 'seen', 'opening', 'birthday', 'card', 'gift', 'said', 'knew', 'special', 'occassion', 'sort']"
77,1632929:5,truly the mark of an attentive waiter.,attentive,positive,"['truly', 'mark', 'attentive', 'waiter']"
78,1649025:2,the food is so cheap and the waiters are nice.,nice,positive,"['food', 'cheap', 'waiter', 'nice']"
79,1655521:3,"the wait staff is very freindly, they make it feel like you're eating in a freindly little european town.",little|little|little,positive,"['wait', 'staff', 'freindly', 'make', 'feel', 'like', 'eating', 'freindly', 'little', 'european', 'town']"
80,1660047:1,"the service was terrible, we had to wait for everything and ask several of different people for the same thing before we were allowed to be served.",terrible|several|same|several|same|terrible,negative,"['service', 'terrible', 'wait', 'everything', 'ask', 'several', 'different', 'people', 'thing', 'allowed', 'served']"
81,1660047:2,"the waitress, seems to be more concerned of looking good than actually waitressing.",concerned|good|concerned|good,negative,"['waitress', 'seems', 'concerned', 'looking', 'good', 'actually', 'waitressing']"
82,1660047:5,"the whole set up is truly unprofessional and i wish cafe noir would get some good staff, because despite the current one this is a great place.",noir|good|good,negative,"['whole', 'set', 'truly', 'unprofessional', 'wish', 'cafe', 'noir', 'would', 'get', 'good', 'staff', 'despite', 'current', 'one', 'great', 'place']"
83,1662726:0,i was here a few weeks back and we had the worst customer service experience at a restaurant ever.,worst|few,negative,"['week', 'back', 'worst', 'customer', 'service', 'experience', 'restaurant', 'ever']"
84,1662726:1,"a gentleman, maybe the manager, came to our table, and without so much as a smile or greeting asked for our order.",much|much,negative,"['gentleman', 'maybe', 'manager', 'came', 'table', 'without', 'much', 'smile', 'greeting', 'asked', 'order']"
85,1700205:2,"considering we were the last patrons there and it was after the closing time, the waitstaff did not rush us at all and made us feel comfortable and relaxed.",comfortable|comfortable,positive,"['considering', 'last', 'patron', 'closing', 'time', 'waitstaff', 'rush', 'u', 'made', 'u', 'feel', 'comfortable', 'relaxed']"
86,1702257:3,friendly staff that actually lets you enjoy your meal and the company you're with.,friendly|friendly,positive,"['friendly', 'staff', 'actually', 'let', 'enjoy', 'meal', 'company']"
87,1707201:3,but the service was a bit slow.,slow,negative,"['service', 'bit', 'slow']"
88,1707741:3,service was also very good.,good,positive,"['service', 'also', 'good']"
89,1727363:2,an excellent service,excellent|excellent,positive,"['excellent', 'service']"
90,1728733:1,we were greeted promptly by the waiter who was very nice and cordial.,nice,positive,"['greeted', 'promptly', 'waiter', 'nice', 'cordial']"
91,1748839:1,"immediately after we paid, the waiter took the money and said, okay, you guys are outta here.",okay,negative,"['immediately', 'paid', 'waiter', 'took', 'money', 'said', 'okay', 'guy', 'outta']"
92,430342:1,"kind, attentive wait staff.",attentive|attentive,positive,"['kind', 'attentive', 'wait', 'staff']"
93,433878:3,the counter service is bad.,counter,negative,"['counter', 'service', 'bad']"
94,449802:5,but who says murray's is anything about service.,,negative,"['say', 'murray', 'anything', 'service']"
95,454704:1,the service is awful.,awful,negative,"['service', 'awful']"
96,475298:0,"good, fast service.",fast,positive,"['good', 'fast', 'service']"
97,483111:0,winnie and her staff are the best crew you can find serving you.,best|best,positive,"['winnie', 'staff', 'best', 'crew', 'find', 'serving']"
98,485767:1,"the service was attentive, yet discreet.",attentive,positive,"['service', 'attentive', 'yet', 'discreet']"
99,490565:1,"the wait staff is pleasant, fun, and for the most part gorgeous (in the wonderful aesthetic beautification way, not in that she's-way-cuter-than-me-that-b@#$* way).",pleasant|pleasant,positive,"['wait', 'staff', 'pleasant', 'fun', 'part', 'gorgeous', 'wonderful', 'aesthetic', 'beautification', 'way', 'sheswaycuterthanmethatb', 'way']"
100,493514:0,i cannot imagine a friendlier staff working in a restaurant.,friendlier,positive,"['imagine', 'friendlier', 'staff', 'working', 'restaurant']"
101,498657:4,"the wait here is long for dim sum, but if you don't like sharing tables or if the typical raucous dim sum atmosphere is not your gig, this is a sleek (for chinatown) alternative.",long,negative,"['wait', 'long', 'dim', 'sum', 'like', 'sharing', 'table', 'typical', 'raucous', 'dim', 'sum', 'atmosphere', 'gig', 'sleek', 'chinatown', 'alternative']"
102,507844:0,this place would be so much better served by being run by a group that actually understands customer service.,better,negative,"['place', 'would', 'much', 'better', 'served', 'run', 'group', 'actually', 'understands', 'customer', 'service']"
103,507937:3,service is fast and friendly.,fast,positive,"['service', 'fast', 'friendly']"
104,511290:4,this place has the the correct ambience and an excellent staff to make you feel like a guest and a friend at the same time.,excellent|excellent,positive,"['place', 'correct', 'ambience', 'excellent', 'staff', 'make', 'feel', 'like', 'guest', 'friend', 'time']"
105,512294:0,"great food, great prices, great service.",great,positive,"['great', 'food', 'great', 'price', 'great', 'service']"
106,512925:2,"also it's great to have dinner in a very romantic and confortable place, the service it's just perfect...they're so frendly that we never want to live the place!",perfecttheyre,positive,"['also', 'great', 'dinner', 'romantic', 'confortable', 'place', 'service', 'perfecttheyre', 'frendly', 'never', 'want', 'live', 'place']"
107,513521:2,drawbacks: service is slow and they don't toast!,slow,negative,"['drawback', 'service', 'slow', 'toast']"
108,519425:3,the waiter was attentive.,attentive,positive,"['waiter', 'attentive']"
109,527109:0,"volare virgins or weekly regulars, everyone gets treated the same and you can't ask for more than that when the service is this friendly.",friendly,positive,"['volare', 'virgin', 'weekly', 'regular', 'everyone', 'get', 'treated', 'cant', 'ask', 'service', 'friendly']"
110,536919:1,the only thing the waiters don't do for you is wipe your chin when you leave.,only,positive,"['thing', 'waiter', 'wipe', 'chin', 'leave']"
111,558423:5,quick and friendly service.,friendly|friendly,positive,"['quick', 'friendly', 'service']"
112,744478:1,"fabulous decor - makes you feel like you're in a trendy manhattan restaurant, very very good food, cheaply-priced, generally friendly staff, and if you're a manhattanite, or spend most of your time in manhattan, rice avenue will make you feel at home.....very soho/village/upper west side minus the expensive prices and pretentious clientele.....all on roosevelt avenue!",friendly|friendly,positive,"['fabulous', 'decor', 'make', 'feel', 'like', 'trendy', 'manhattan', 'restaurant', 'good', 'food', 'cheaplypriced', 'generally', 'friendly', 'staff', 'manhattanite', 'spend', 'time', 'manhattan', 'rice', 'avenue', 'make', 'feel', 'homevery', 'sohovillageupper', 'west', 'side', 'minus', 'expensive', 'price', 'pretentious', 'clienteleall', 'roosevelt', 'avenue']"
113,746254:4,"with so many good restaurants on the uws, i don't need overpriced food, absurdly arrogant wait-staff who don't recognize they work at a glorified diner, clumsy service, and management that doesn't care.",clumsy|arrogant|arrogant,negative,"['many', 'good', 'restaurant', 'uws', 'need', 'overpriced', 'food', 'absurdly', 'arrogant', 'waitstaff', 'recognize', 'work', 'glorified', 'diner', 'clumsy', 'service', 'management', 'care']"
114,751493:0,i am relatively new to the area and tried pick a bgel on 2nd and was disappointed with the service and i thought the food was overated and on the pricey side.,2nd,negative,"['relatively', 'new', 'area', 'tried', 'pick', 'bgel', 'nd', 'disappointed', 'service', 'thought', 'food', 'overated', 'pricey', 'side']"
115,TM#5:3,helpful service and average price per dish $10.,helpful,positive,"['helpful', 'service', 'average', 'price', 'per', 'dish', '']"
116,TFS#5:30,"service was just ok, it is not what you'd expect for $500.",ok,negative,"['service', 'ok', 'expect', '']"
117,CLF#6:5,"they are extremely rude, not even apologizing for the horrible service we got and handing us a bill well over $500 for some drinks adn their pita bread!",horrible,negative,"['extremely', 'rude', 'even', 'apologizing', 'horrible', 'service', 'got', 'handing', 'u', 'bill', 'well', '', 'drink', 'adn', 'pita', 'bread']"
118,DBG#6:7,"the meat is fresh, the sauces are great, you get kimchi and a salad free with your meal and service is good too.",good,positive,"['meat', 'fresh', 'sauce', 'great', 'get', 'kimchi', 'salad', 'free', 'meal', 'service', 'good']"
119,BFC#7:11,"considering you will spend at least $60 a head, i expect better service.",better,negative,"['considering', 'spend', 'least', '', 'head', 'expect', 'better', 'service']"
