,id,review,opinion,label,predict
0,1014458:3,The wine list is interesting and has many good values.,interesting,positive,positive
1,1064477:4,We took advanatage of the half price sushi deal on saturday so it was well worth it.,worth,positive,positive
2,1084394:3,The Prix Fixe menu is worth every penny and you get more than enough (both in quantity AND quality).,worth|worth,positive,positive
3,1086415:2,"$6 and there is much tasty food, all of it fresh and continually refilled.",fresh,positive,positive
4,1090587:2,Add to that great service and great food at a reasonable price and you have yourself the beginning of a great evening.,great,positive,positive
5,1119578:1,The pizza is overpriced and soggy.,soggy,negative,negative
6,1189674:4,"Great wine selection, Gigondas is worth the price, and the house champagne is a great value.",great|price,positive,positive
7,1212346:4,Tiny dessert was $8.00...just plain overpriced for what it is.,tiny,negative,negative
8,1221938:0,The drinks are always welll made and wine selection is fairly priced.,welll,positive,negative
9,1225162:4,The bar is very well stocked with interesting beers and well priced wines.,interesting|interesting,positive,positive
10,1338124:0,"This is some really good, inexpensive sushi.",good,positive,positive
11,1338124:2,The spicy Tuna roll is huge and probably the best that I've had at this price range.,huge|huge,positive,negative
12,1338124:4,"I have reservations about the all you can eat deal, however -- the choices are fairly limited and you can probably order more food than you can eat for less than $18 by just going off the menu.",limited|more,negative,negative
13,1340075:1,"They have it all -- great price, food, and service.",great,positive,positive
14,1398844:3,Slightly above average wines start at $70+ with only one selection listed at $30+.,average,negative,negative
15,1439875:3,The food can get pricey but the prixe fixe tasting menu is the greatest food for a good price and they cater the food to any food allergies or food you don't like.,greatest|greatest|food|food|food,positive,positive
16,1506491:0,"I have known about this secret for the last 13 years, Emilio(the Godfather) has continued to serve food and wine for the gods at mortal prices.",mortal|last,positive,negative
17,1538149:0,"I found the food, service and value exceptional everytime I have been there.",exceptional,positive,positive
18,1561259:4,"This place is pricey, and yes, the food is worth it; but the service makes you feel like you should be paying a quater of the price.",worth,positive,positive
19,1572027:3,I ate here a week ago and found most dishes average at best and too expensive.,average,negative,negative
20,1609375:4,"Just because it's cheap does NOT mean the portions are small or the food is nasty, IT IS GREAT!",nasty|small,positive,positive
21,1611489:1,"Also, the sandwiches (nearing $7) didn't come with anything like chips or a side.",-|-|-,negative,negative
22,1632445:5,"Even though its good seafood, the prices are too high.",good,positive,positive
23,1655504:1,Cheese plate is a varied delight and great bargain at $10.,delight|delight|bargain,positive,positive
24,1655504:4,Wine list is extensive without being over-priced.,extensive,positive,negative
25,1655521:2,"The food was very good, a great deal, and the place its self was great.",good,positive,positive
26,1661757:2,"The ambience was so fun, and the prices were great, on top of the fact that the food was really tasty.",prices|tasty,positive,negative
27,1671113:1,The food is great and reasonably priced.,great,positive,positive
28,1748813:1,All of the pizzas are terrific and the price is even better!,terrific,positive,positive
29,404464:3,I expected quite a bit more from such an expensive menu.,expensive,negative,negative
30,426930:0,Authentic Taiwanese food that's cheap... what more could you ask for?,authentic,positive,positive
31,436868:2,"The sandwiches are dry, tasteless and way overpriced.",dry,negative,negative
32,475298:2,Food is great and inexpensive.,great,positive,positive
33,490565:4,"You can get a completely delish martini in a glass (that's about 2 1/2 drinks) for $8.50 (I recommend the Vanilla Shanty, mmmm!) in a great homey setting with great music.",recommend|shanty,positive,positive
34,498657:2,"The rest of the dim sum, though pricey by Chinatown standards, is worth it.",worth,positive,positive
35,507937:2,Spreads and toppings are great - though a bit pricey.,great,positive,positive
36,512294:0,"Great food, great prices, great service.",great,positive,positive
37,527109:3,The wine list is extensive and can easily hike up an otherwise reasonably priced meal.,extensive,positive,negative
38,584025:2,The food is great and they have a good selecion of wines at reasonable prices.,great|good,positive,positive
39,620892:3,Ravioli was good...but I have to say that I found everything a bit overpriced.,good|overpriced,positive,negative
40,624715:4,"Just straight up cheap, good food.",good,positive,positive
41,626269:3,bottles of wine are cheap and good.,cheap|cheap,positive,negative
42,657129:3,the drinks are amazing and half off till 8pm.,amazing,positive,positive
43,720418:4,Great food and the prices are very reasonable.,reasonable,positive,positive
44,720620:5,Simply some good tasting Chinese food at incredible prices...,good|good,positive,positive
45,735448:2,"good music, great food, speedy service affordable prices.",good|good,positive,positive
46,740923:2,Price and quality of fish alone will keep us from making a return visit.,-,negative,negative
47,744478:1,"Fabulous decor - makes you feel like you're in a trendy Manhattan restaurant, very very good food, cheaply-priced, generally friendly staff, and if you're a Manhattanite, or spend most of your time in Manhattan, Rice Avenue will make you feel at home.....very Soho/Village/Upper West Side minus the expensive prices and pretentious clientele.....all on Roosevelt Avenue!",trendy|trendy,positive,positive
48,751493:0,I am relatively new to the area and tried Pick a bgel on 2nd and was disappointed with the service and I thought the food was overated and on the pricey side.,side,negative,negative
49,757762:0,Baluchi's has solid food and a nice decor at reasonable prices.,solid,positive,positive
50,Z#3:2,"I paid just about $60 for a good meal, though :)",good,positive,positive
51,TM#7:0,Excellent food for great prices,excellent,positive,positive
52,P#10:3,And $11 for a plate of bland guacamole?,bland|bland,negative,negative
53,TM#3:3,"The food was good, the place was clean and affordable.",good,positive,positive
54,BzG#2:1,"The food is flavorful, plentiful and reasonably priced.",flavorful,positive,negative
55,TVU#6:3,The martinis are amazing and very fairly priced.,amazing,positive,positive
56,CLF#3:13,"However, our $14 drinks were were horrible!",horrible,negative,negative
57,CLF#3:23,I would not expect this for a $55 dinner.,-,negative,negative
58,CLF#3:28,"By the time we left our wallets were empy and so were our stomachs AND we missed the show we were supposed to see following our dinner, which would have been acceptable if we got to enjoy the experience of good food and belly dancers!",enjoy|food|food,negative,positive
59,BFC#9:21,"All in all the food was good - a little on the expensive side, but fresh. ",good,positive,positive
60,BG#5:7,"But if you're prepared to spend some $ and remember to ask if something they offer is complimentary, then this is the place to go for Indian food",indian,positive,negative
61,BG#8:3,The lunch buffet is expensive but is deff worth it.,expensive|expensive,positive,negative
62,DBG#6:7,"The meat is fresh, the sauces are great, you get kimchi and a salad free with your meal and service is good too.",fresh|good|great|kimchi|salad,positive,positive
63,TR#5:6,"Price is high but the food is good, so I would come back again.",good,positive,positive
64,FF#3:9,"I took one bite from the $24 salmon, and I have never, in the 17 years I have been going to restaurants tasted salmon as fishy, as dry, and as bland as the one in Flatbush Farms.",fishy|fishy|fishy|fishy|fishy|fishy,negative,negative
65,BHD#8:1,"At first glance this place seems a bit pricey for a hot dog joint, but at Bark you don't just get your average hot dog.",hot|hot|dog,positive,positive
66,WE#1:3,"The bread was stale, the salad was overpriced and empty.",stale,negative,negative
67,1004293:3,The food was lousy - too sweet or too salty and the portions tiny.,lousy|tiny,negative,negative
68,1014458:0,"I have eaten at Saul, many times, the food is always consistently, outrageously good.",consistently,positive,positive
69,1014458:2,The duck confit is always amazing and the foie gras terrine with figs was out of this world.,amazing|amazing,positive,positive
70,1016296:4,Chow fun was dry; pork shu mai was more than usually greasy and had to share a table with loud and rude family. ,greasy|greasy|dry|loud|greasy,negative,negative
71,1032695:1,"Everything is always cooked to perfection, the service is excellent, the decor cool and understated.",service,positive,negative
72,1041457:2,"The food is very average...the Thai fusion stuff is a bit too sweet, every thing they serve is too sweet here.",average,negative,negative
73,1041457:3,The only thing I moderately enjoyed was their Grilled Chicken special with Edamame Puree.,only|chicken,positive,negative
74,1041457:4,I had never had Edamame pureed before but I thought it was innovative and tasty (could've used a bit more salt).,more,positive,negative
75,1053543:2,"Their sake list was extensive, but we were looking for Purple Haze, which wasn't listed but made for us upon request!",extensive,positive,negative
76,1053543:3,"The spicy tuna roll was unusually good and the rock shrimp tempura was awesome, great appetizer to share!",good|awesome|good|tempura|awesome,positive,positive
77,1062641:2,Food is great.,great,positive,positive
78,1064477:0,"I tend to judge a sushi restaurant by its sea urchin, which was heavenly at sushi rose.",heavenly|heavenly|heavenly|heavenly|heavenly|heavenly|heavenly,positive,positive
79,1064477:2,The sushi seemed pretty fresh and was adequately proportioned.,fresh,positive,positive
80,1064477:3,The rice to fish ration was also good--they didn't try to overpack the rice.,good|good,positive,positive
81,1074868:4,The food was well prepared and the service impecable.,prepared,positive,negative
82,1086415:3,"I am not a vegetarian but, almost all the dishes were great.",great,positive,positive
83,1086478:0,"The food here is rather good, but only if you like to wait for it.",good,positive,positive
84,1086478:1,"I like the somosas, chai, and the chole, but the dhosas and dhal were kinda dissapointing.",dissapointing|dissapointing|dissapointing,positive,negative
85,1086478:4,"Also, specify if you like your food spicy- its rather bland if you don't.",bland,negative,negative
86,1090587:3,The lava cake dessert was incredible and I recommend it.,incredible|incredible|incredible,positive,positive
87,1118167:2,The pizza was delivered cold and the cheese wasn't even fully melted!,cold|cold,negative,negative
88,1119578:2,"Yes, they use fancy ingredients, but even fancy ingredients don't make for good pizza unless someone knows how to get the crust right.",fancy|good,negative,positive
89,1123262:0,I think I've had some the best meals of my life at minnow.,best|best,positive,positive
90,1123262:1,"The seafood is amazing, there's a good wine list, and the ever-changing menu always offers some great surprises.",amazing|good|ever-changing|menu,positive,positive
91,1123262:2,The combination of super-fresh ingredients in the dishes are unusual but really delicious.,unusual|super-fresh,positive,negative
92,1125006:1,Best Pastrami I ever had and great portion without being ridiculous.,portion,positive,negative
93,1125006:3,My wife had the fried shrimp which are huge and loved it.,fried|shrimp,positive,negative
94,1125284:2,"The signs, the specials menus, food, and even all the waitstaff are ALL TOTALLY Japanese.",japanese|menus,positive,negative
95,1126814:0,"Leon is an East Village gem: casual but hip, with well prepared basic French bistro fare, good specials, a warm and lively atmosphere.",gem|prepared|prepared|leon|good,positive,positive
96,1126886:2,"The service is excellent, the decor is great, and the food is delicious and comes in large portions.",delicious|large,positive,positive
97,1131595:3,The food was bland oily.,bland|bland,negative,negative
98,1138996:1,"We have been to this place many times, and always have great food, wine, and service.",great|great,positive,positive
99,1138996:3,As always we had a great glass of wine while we waited.,great|great,positive,positive
100,1145510:1,The pizza is yummy and I like the atmoshpere.,yummy,positive,negative
101,1147082:0,I went there for lunch and it was not as good as I expected from the reviews I read.,good,negative,negative
102,1147082:1,Sauce was watery and the food didn't have much flavor.,watery|much|flavor,negative,negative
103,1147211:2,The waitress was very patient with us and the food is phenomenal!,phenomenal,positive,positive
104,1153034:0,Great pizza and fantastic service.,great,positive,positive
105,1154550:0,This is the best sushi in new york city - hands down.,best,positive,positive
